rank	word	pos	en
1	que	pron	that, which; that, who, whom
2	no	noun	abbreviation of nord-oest
3	de	noun	The name of the Latin script letter D/d.
4	la	article	the; feminine singular definite article
5	el	article	the; definite article; neuter definite article used to make abstract nouns from adjectives; the; what, that which
6	a	character	The first letter of the Catalan alphabet, written in the Latin script.
7	i	character	A letter of the Catalan alphabet, called i and written in the Latin script.
8	és	verb	third-person singular present indicative of ser; third-person singular present indicative of ésser
9	un	article	an; the indefinite article; some
10	per	prep	through, via: used in indicating the medium through which passage occurs; at, during, in: used in indicating the time at which an event occurs; during, for: used in indicating the duration of time for which an event occurs
11	en	article	Personal article used before masculine given names instead of the definite article el.
12	l	character	The twelfth letter of the Catalan alphabet, called ela, ele or el and written in the Latin script.
13	d	character	The fourth letter of the Catalan alphabet, called de and written in the Latin script.
14	una	article	feminine singular of un
15	què	pron	what (interrogative); that, which (impersonal pronoun)
16	ho	pron	it (direct object); replaces the demonstrative pronouns açò, això and allò; replaces an independent clause (one which could grammatically form a sentence on its own); replaces an adjective or an indefinite noun which serves as the predicate of ésser, esdevenir, estar or semblar
17	ha	verb	third-person singular present indicative of haver
18	els	article	the; masculine plural definite article
19	amb	prep	with
20	va	adj	vain (having no real substance); vain (effecting no real purpose)
21	això	pron	that, it; this, it
22	si	conj	if
23	com	adv	how; like; as ... as
24	les	article	the; feminine plural definite article
25	em	pron	me (direct or indirect object)
26	m	character	The thirteenth letter of the Catalan alphabet, called ema, eme or em and written in the Latin script.
27	hi	pron	"represents a place associated with the action described by the verb, unless the place would be introduced by the preposition de; there (in constructions such as ""there is"", ""there are"", etc.: see haver-hi); replaces an adverb (or adverbial phrase) describing the manner, instrument or association of an action"
28	però	adv	however
29	sí	particle	yes (affirmation; commonly used to respond affirmatively to a question)
30	bé	adv	well
31	al	contraction	contraction of a + el, literally “at the; to the”
32	del	contraction	Contraction of the preposition de and the article el. of the
33	he	noun	he (fifth letter of various Semitic alphabets)
34	t	character	The twentieth letter of the Catalan alphabet, called te and written in the Latin script.
35	aquí	adv	here; there
36	tu	pron	you (singular); thou; one (singular, impersonal)
37	et	pron	you, thee (singular, direct or indirect object)
38	més	adv	more (used to form comparatives); (the) most (used to form superlatives)
39	es	pron	himself, herself, itself (direct or indirect object); oneself (direct or indirect object); themselves (direct or indirect object)
40	jo	pron	I; me
41	tot	adj	all
42	vaig	verb	first-person singular present indicative of anar; first-person singular present indicative of anar used to form periphrastic past
43	està	verb	third-person singular present indicative of estar
44	ser	verb	to be, to exist; to be located (to be in a place); to be (used to connect a noun to another noun)
45	molt	adj	much, many
46	meu	pron	my, mine
47	fer	verb	to make, produce; to make up; to do, to cause to be done
48	has	verb	second-person singular present indicative of haver
49	ja	adv	already, (in negative sentences) any more; now, immediately, at once; confidence in the outcome
50	ara	adv	now (at the present time)
51	aquest	det	this
52	aquesta	det	feminine singular of aquest
53	s	character	The nineteenth letter of the Catalan alphabet, called essa, esse or es and written in the Latin script.
54	li	pron	him, her, it (indirect object, singular all genders)
55	ens	pron	us (direct or indirect object)
56	quan	adv	when
57	cap	noun	head; boss, chief, leader; cape (piece of land)
58	res	pron	nothing, not anything; anything (in questions or in negative sentences)
59	n	character	The fourteenth letter of the Catalan alphabet, called ena, ene or en and written in the Latin script.
60	meva	pron	feminine singular of meu
61	només	adv	only, just
62	dir	verb	to say, to pronounce; to say, to tell; to call, to refer to as
63	on	adv	where
64	sé	verb	first-person singular present indicative of saber
65	cosa	noun	thing; affair, matter
66	era	noun	era (time period)
67	seu	pron	his, her/hers, its; their, theirs; your, yours (alluding to vostè or vostès)
68	qui	pron	who, whom; whoever
69	sóc	verb	superseded spelling of soc (first singular present indicative of ser and ésser), deprecated in the 2016 orthographic reform by the Institute of Catalan Studies
70	així	adv	so, thus, in this way; then, in consequence
71	o	character	The fifteenth letter of the Catalan alphabet, called o and written in the Latin script.
72	estic	noun	hockey stick
73	ets	verb	second-person singular present indicative of ser; second-person singular present indicative of ésser
74	us	pron	you (plural, direct or indirect object); contraction of vos
75	ell	pron	he
76	teu	pron	your, yours (singular)
77	mi	pron	me; post preposition form of jo
78	puc	verb	first-person singular present indicative of poder
79	veure	verb	to see; to find (someone or something to be a certain way); (with pronoun hi) to be able to see
80	perquè	conj	why, because; so that (followed by the subjunctive)
81	seva	pron	feminine singular of seu
82	són	verb	third-person plural present indicative of ser; third-person plural present indicative of ésser
83	dels	contraction	contraction of de + els, literally “of the, from the (masculine plural)”
84	vull	verb	first-person singular present indicative of voler
85	fet	noun	fact
86	acord	noun	agreement, accordance; agreement; chord
87	fa	noun	fa (fourth note of diatonic scale)
88	hem	verb	first-person plural present indicative of haver
89	vas	noun	glass (a drinking glass); vessel
90	han	verb	third-person plural present indicative of haver
91	mai	adv	never; ever
92	tinc	verb	first-person singular present indicative of tenir; first-person singular present indicative of tindre
93	tots	pron	all; everyone
94	té	verb	inflection of tenir:; third-person singular present indicative
95	gràcies	intj	thanks
96	teva	pron	feminine singular of teu
97	estàs	verb	second-person singular present indicative of estar
98	estat	noun	state; government; condition
99	van	verb	third-person plural present indicative of anar; third-person plural present indicative of anar used to form periphrastic past
100	pot	noun	jar, canister, vessel; jackpot
101	senyor	noun	lord, master; owner, proprietor; mister; sir; My Lord
102	saps	verb	second-person singular present indicative of saber
103	casa	noun	house
104	home	noun	man; husband
105	tan	adv	so, such; as ... as
106	vols	verb	second-person singular present indicative of voler
107	alguna	det	feminine singular of algun
108	tens	adj	tense, taut
109	ella	pron	she
110	temps	noun	time; weather
111	potser	adv	maybe, perhaps
112	se	pron	himself, herself, itself (direct or indirect object); oneself (direct or indirect object); themselves (direct or indirect object)
113	fins	prep	until, till (time); to, up to (place); up to (amount)
114	pare	noun	father
115	encara	adv	yet; still; even (implying an extreme example)
116	anar	verb	to go; forms the periphrastic preterite; see usage notes below for more information; to go away, to leave requires a reflexive pronoun according the subject, and the appropriate form of the adverbial pronoun en
117	dit	noun	finger, toe; fingerbreadth
118	crec	verb	first-person singular present indicative of creure
119	pots	verb	second-person singular present indicative of poder
120	també	adv	also, too
121	hola	intj	hello, hi
122	dia	noun	day (period of 24 hours); day (the part of the day between sunrise and sunset)
123	nit	noun	night
124	dos	num	two
125	sobre	prep	on, on top of; over, above; about (a subject)
126	ni	conj	neither, nor
127	vida	noun	life
128	pel	prep	contraction of per + el
129	déu	name	God
130	gent	noun	people, folk
131	sempre	adv	always
132	després	adv	later; afterwards; then, following that
133	vol	noun	flight (act of flying); flock (group of animals flying together); shoal (group of animals swimming together)
134	algú	pron	someone, somebody; anyone, anybody
135	als	contraction	to the, at the, toward the (masculine plural)
136	sap	noun	common heather
137	anys	noun	plural of any
138	havia	verb	first/third-person singular imperfect indicative of haver; first/third-person singular imperfect indicative of heure
139	abans	adv	before (earlier than in time); before (in front of)
140	passa	noun	step, pace; Spanish pace, a former unit of length
141	coses	noun	plural of cosa
142	nosaltres	pron	we
143	mateix	adj	serves as an intensifier in the same manner that in English would be performed by the appropriate reflexive pronoun (myself, himself, themselves, etc.)
144	mare	noun	mother; uterus (of an animal); main course of a river or canal; channel
145	sense	prep	without
146	sembla	verb	inflection of semblar:; third-person singular present indicative
147	millor	adj	comparative degree of bo; better; superlative degree of bo; best
148	altre	adj	other; previous, last
149	estava	verb	first/third-person singular imperfect indicative of estar
150	tant	adj	so much, as much; so many, as many
151	parlar	verb	to speak (to communicate with one's voice); to speak (to deliver a message to a group; to deliver a speech); to talk about, to mention, to address
152	llavors	adv	then, at that time; next, after that; then, in that case, so
153	tenim	verb	first-person plural present indicative of tenir; first-person plural present indicative of tindre
154	allà	adv	there, over there
155	vostè	pron	you (formal, singular)
156	hauria	verb	first/third-person singular conditional of haver; first/third-person singular conditional of heure
157	ningú	pron	no one, nobody; anyone, anybody
158	dona	noun	woman; wife
159	sigui	verb	inflection of ser:; first/third-person singular present subjunctive
160	estar	verb	to be; to currently be in a state or have a characteristic (Used to connect a noun to an adjective that describes a temporary state of being.); forms the continuous aspect, together with a present participle; to stay, to live or spending time.
161	veritat	noun	truth
162	mica	noun	a bit, a small piece
163	bona	adj	feminine singular of bo
164	gran	adj	big, large; old; older; oldest, eldest, senior
165	haver	verb	auxiliary verb to form compound tenses or perfect tenses, together with a past participle; to have, to possess
166	mort	noun	death
167	lloc	noun	place; location
168	mira	noun	look, glance; intention, aim; sight, scope
169	anem	verb	inflection of anar:; first-person plural present indicative/subjunctive
170	sento	verb	first-person singular present indicative of sentir
171	fora	prep	out, outside
172	doncs	adv	then; so, therefore
173	me	pron	me (direct or indirect object)
174	plau	verb	inflection of plaure:; third-person singular present indicative
175	fill	noun	son
176	podria	verb	first/third-person singular conditional of poder
177	vist	verb	past participle of veure; past participle of veure's
178	oi	noun	hatred; aversion, revulsion, nausea
179	oh	intj	oh (expression of surprise, etc.)
180	vegada	noun	time, occasion
181	moment	noun	moment (specific instant or time)
182	podem	verb	first-person plural present indicative of poder; inflection of podar:; first-person plural present indicative/subjunctive
183	seus	pron	masculine plural of seu
184	diu	verb	third-person singular present indicative of dir; inflection of diure:; third-person singular present indicative
185	estem	verb	first-person plural present indicative of estar
186	tenir	verb	to have, possess; to hold
187	passat	adj	last (most recent); past (occurring in the past)
188	altra	adj	feminine singular of altre
189	bon	adj	good; alternative form of bo
190	estan	verb	third-person plural present indicative of estar
191	des	prep	from
192	segur	adj	safe; secure; sure, certain
193	prou	adj	enough, sufficient
194	ells	pron	they (masculine or mixed group)
195	te	noun	The name of the Latin script letter T/t.
196	clar	adj	clear; bright, well-lit; light (colour)
197	merda	noun	dung, excrement, shit
198	tota	adj	feminine singular of tot
199	massa	adj	too much, too many
200	homes	noun	plural of home
201	serà	verb	third-person singular future indicative of ser; third-person singular future indicative of ésser
202	nostre	pron	our, ours
203	ei	intj	hey (exclamation to get attention)
204	meus	pron	masculine plural of meu
205	manera	noun	way; manner; method; style; manners, etiquette
206	aquests	adj	masculine plural of aquest
207	cop	noun	hit, blow, strike; time, occasion
208	tenia	verb	first/third-person singular imperfect indicative of tenir; first/third-person singular imperfect indicative of tindre
209	deixa	verb	inflection of deixar:; third-person singular present indicative
210	passar	verb	to pass, to pass by, to go by (to move past); to pass as, to be interpreted as; to happen, to occur
211	fas	noun	plural of fa
212	saber	verb	to know (a fact), to have knowledge; to know how to
213	porta	noun	doorway, gateway; door; gate
214	món	noun	planet; world
215	volia	verb	first/third-person singular imperfect indicative of voler
216	som	adj	shallow
217	espera	verb	inflection of esperar:; third-person singular present indicative
218	tornar	verb	to return, to go/come back; to return, to give back; to do again, to repeat
219	tres	num	three
220	quin	adj	which, what; what a
221	primer	adj	first; prime (having no divisor except itself and 1)
222	quina	noun	fivesome (a group of five people or things); a game similar to bingo frequently played around Christmastime
223	aquestes	det	feminine plural of aquest
224	feina	noun	work, job
225	nou	adj	new
226	matar	verb	to kill; to extinguish
227	nom	noun	name (word that indicates a particular person, place, or thing); noun; name (reputation)
228	trobar	verb	to find; to meet; to be located
229	nostra	adj	feminine singular of nostre
230	cada	adj	each; every
231	sentit	noun	sense (as in sight, hearing etc.); sense, meaning; consciousness
232	nostres	pron	plural of nostre
233	agrada	verb	inflection of agradar:; third-person singular present indicative
234	rei	noun	king; darling, sport (name given to a male child or friend)
235	diners	noun	money
236	part	noun	birthing (act of giving birth); birth of an idea
237	raó	noun	reason, motive; reason (human faculty); ratio
238	totes	adj	feminine plural of tot
239	escolta	noun	listening, eavesdropping
240	deixar	verb	to leave (to refrain from taking (something) away); to let oneself go (to cease to care about one's appearance); to leave (to put; to place)
241	germà	noun	brother; sibling
242	vam	verb	first-person plural present indicative of anar used to form periphrastic past
243	amic	noun	friend
244	altres	adj	plural of altre
245	qualsevol	det	any; whichever, whatever
246	mal	noun	evil, bad; illness
247	creus	noun	plural of creu
248	uns	article	masculine plural of un
249	necessito	verb	first-person singular present indicative of necessitar
250	hora	noun	hour (sixty minutes); time (the moment as indicated by a clock); time (the appropriate hour to do something)
251	fent	verb	gerund of fer
252	avui	adv	today; nowadays
253	família	noun	family
254	dins	adv	in, within, inside
255	sol	name	the Sun (the center of our solar system)
256	policia	noun	police
257	heu	verb	inflection of haver:; third-person singular present indicative
258	ben	adv	alternative form of bé
259	amor	noun	love
260	seves	pron	feminine plural of seu
261	poder	verb	to be able; can; to be allowed, to be permitted; may
262	noi	noun	boy, young man
263	morir	verb	to die
264	durant	prep	for, during (over a period of time)
265	noia	noun	girl, young woman; slowworm
266	greu	adj	heavy, weighty; grave, serious; hard, difficult
267	debò	adv	only used in de debò
268	tothom	pron	everyone, everybody
269	terra	noun	earth; land
270	punt	noun	point (specific location); dot, point (punctuation mark); point (used for separating the fractional part from the whole part)
271	idea	noun	An idea, a mental representation of a real or imaginary thing; An elementary or general notion of something; A concept to be realized, plan of action, purpose, intention
272	donar	verb	to give
273	teus	pron	masculine plural of teu
274	cotxe	noun	carriage; car
275	problema	noun	problem (difficulty; obstacle); problem (question; schoolwork exercise)
276	deu	num	ten
277	algun	det	some; any
278	sortir	verb	to go out, to leave; to go out (to leave one's abode to go to public places, especially for recreation or entertainment); to come out, to appear, to emerge
279	aquell	det	that
280	entre	prep	between; among
281	venir	verb	to come
282	guerra	noun	war
283	trobat	noun	tawny pipit (Anthus campestris)
284	bo	adj	good
285	dic	noun	dyke (a barrier to prevent flooding)
286	ciutat	noun	city
287	tenen	verb	third-person plural present indicative of tenir; third-person plural present indicative of tindre
288	collons	noun	plural of colló
289	sang	noun	blood
290	pensar	verb	to think; to think about, to think of, to have in mind; to think about, to be of the opinion about
291	vosaltres	pron	you (plural)
292	dues	num	feminine of dos
293	dius	verb	second-person singular present indicative of dir
294	seria	verb	first/third-person singular conditional of ser; first/third-person singular conditional of ésser
295	faré	verb	first-person singular future indicative of fer
296	amics	noun	plural of amic
297	dies	noun	plural of dia
298	contra	adv	against
299	nois	noun	plural of noi
300	sabia	verb	first/third-person singular imperfect indicative of saber
301	demà	adv	tomorrow
302	vegades	noun	plural of vegada
303	acabat	noun	finish (protective coating)
304	pas	noun	pace, step; paso, Spanish pace, a traditional unit of length; pace, action
305	pensava	verb	first/third-person singular imperfect indicative of pensar
306	ajuda	noun	help, assistance, aid
307	menjar	verb	to eat something solid; to eat (something); to consume, to deplete (something)
308	cal	contraction	contraction of ca + el
309	cas	noun	case (event, situation, or fact)
310	por	noun	fear
311	nova	adj	feminine singular of nou
312	veig	verb	first-person singular present indicative of veure
313	quant	adj	how many; how much; quite a bit; quite a few (considerably)
314	arribar	verb	to arrive; to happen
315	aviat	adv	soon; early
316	tard	adv	late
317	filla	noun	daughter
318	vingut	verb	past participle of venir
319	anat	verb	past participle of anar
320	senyora	noun	female equivalent of senyor; lady; Mrs
321	entenc	verb	first-person singular present indicative of entendre
322	mentre	conj	while; as long as
323	hauries	verb	second-person singular conditional of haver; second-person singular conditional of heure
324	importa	verb	inflection of importar:; third-person singular present indicative
325	sentir	verb	to sense; to feel; to hear of something
326	agradaria	verb	first/third-person singular conditional of agradar
327	sols	adv	only, just
328	començar	verb	to begin, to start something; to begin, to start happening something; to begin, to start doing
329	vine	verb	second-person singular imperative of venir
330	ah	intj	ah (expression of relief, realization, awe); ah (expression of woe, grief)
331	faig	noun	beech (tree)
332	capità	noun	captain
333	mà	noun	hand; quire
334	realment	adv	really; in a real way
335	favor	noun	favour
336	suposo	verb	first-person singular present indicative of suposar
337	cara	noun	face (front part of the head); face (public image); heads (side of a coin)
338	sort	noun	luck; fortune
339	queda	adj	feminine singular of quet
340	ulls	noun	plural of ull
341	puta	noun	whore, slut
342	compte	noun	count (act of counting or tallying something); count (a quantity counted); care (close attention)
343	veus	noun	plural of veu (“voice”)
344	poden	verb	third-person plural present indicative of poder
345	aigua	noun	water
346	sota	prep	under, underneath, below, beneath
347	penso	verb	first-person singular present indicative of pensar
348	tingut	verb	past participle of tenir; past participle of tindre
349	persona	noun	person
350	camí	noun	road; way; path
351	moltes	adj	feminine plural of molt (“much, many”)
352	fos	verb	first/third-person singular imperfect subjunctive of ser; first/third-person singular imperfect subjunctive of ésser
353	davant	adv	ahead; in front
354	vostre	pron	your, yours (plural)
355	història	noun	history; story, tale
356	penses	verb	second-person singular present indicative of pensar
357	cinc	num	five
358	cert	adj	true; certain
359	pels	prep	contraction of per + els
360	entrar	verb	to enter
361	hagi	verb	first/third-person singular present subjunctive of haver
362	menys	adv	less (not as much)
363	primera	adj	feminine singular of primer
364	mes	noun	month
365	fills	noun	plural of fill
366	molts	adj	masculine plural of molt (“much”)
367	portar	verb	to carry; to bring; to wear
368	petit	adj	small, little
369	costat	noun	side
370	unes	article	feminine plural of un
371	posar	verb	to put, to place; to set; to apply (medication or cosmetics)
372	ajudar	verb	to help, aid
373	cor	noun	heart
374	adéu	intj	superseded spelling of adeu, deprecated in the 2016 orthographic reform by the Institute of Catalan Studies
375	important	adj	important
376	dones	noun	plural of dona
377	tal	adj	such (like this, that)
378	val	noun	voucher
379	espero	verb	first-person singular present indicative of esperar
380	veu	noun	voice; word, term
381	viu	adj	living, alive; lively, vivid
382	gaire	adj	not much, hardly any; any; not many, hardly any
383	aquella	det	feminine singular of aquell
384	dóna	verb	superseded spelling of dona (third singular present indicative of donar), deprecated in the 2016 orthographic reform by the Institute of Catalan Studies
385	nens	noun	plural of nen (“boy”)
386	diuen	verb	third-person plural present indicative of dir
387	sou	noun	salary, wage
388	hagués	verb	first/third-person singular imperfect subjunctive of haver; first/third-person singular imperfect subjunctive of heure
389	persones	noun	plural of persona
390	prendre	verb	to take; to drink; to make (a decision)
391	just	adj	fair; just; perfect, almost perfect
392	mans	adj	tame
393	perdut	verb	past participle of perdre
394	fan	verb	third-person plural present indicative of fer
395	poc	det	little, not much; few, not many; a few, not a lot of
396	creure	verb	to take as true; to think, to believe; to believe as saying the truth
397	sabem	verb	first-person plural present indicative of saber
398	nen	noun	boy, male child
399	junts	noun	plural of junt
400	endavant	adv	forward (in space or time)
401	fem	noun	dung; manure (animal excrement used as fertilizer); rubbish
402	única	adj	feminine singular of únic
403	hores	noun	plural of hora
404	marxar	verb	to go, leave, depart; to function, work, run; to march
405	vostra	pron	feminine singular of vostre
406	eren	verb	third-person plural imperfect indicative of ser; third-person plural imperfect indicative of ésser
407	malament	adv	badly
408	tornat	verb	past participle of tornar
409	vés	verb	superseded spelling of ves (second singular imperative of anar), deprecated in the 2016 orthographic reform by the Institute of Catalan Studies
410	únic	adj	only; unique
411	podia	verb	first/third-person singular imperfect indicative of poder
412	perdre	verb	to lose; to get lost; to disappear; to miss (as in to miss a train, a film etc.)
413	minuts	noun	plural of minut
414	aleshores	adv	then, back then, in those times; so, then, in that case
415	any	noun	year
416	sent	verb	gerund of ésser; gerund of ser
417	tipus	noun	type, sort, kind
418	mateixa	adj	feminine singular of mateix
419	hauríem	verb	first-person plural conditional of haver; first-person plural conditional of heure
420	meves	pron	feminine plural of meu
421	farà	verb	third-person singular future indicative of fer
422	treball	noun	work; job; employment; task
423	servir	verb	to serve; to be useful, to be good for
424	força	noun	force
425	paio	noun	dude, man (losing its original meaning of non-Romani); gadjo (non-Romani)
426	matí	noun	morning
427	col	noun	cabbage
428	marit	noun	husband (spouse)
429	forma	noun	form; shape
430	faci	verb	inflection of fer:; first/third-person singular present subjunctive
431	problemes	noun	plural of problema
432	deixat	adj	slovenly, careless
433	quatre	num	four; a few
434	ve	noun	The name of the Latin script letter V/v.
435	habitació	noun	habitation (act of inhabiting); habitat; room (a separate part of a building)
436	parla	noun	speech; speaking (action)
437	viure	verb	to live, to be alive; to survive, to persevere; to live, to reside
438	treure	verb	to take out, take off, take down; to take away, carry out, carry away; to remove
439	doctor	noun	doctor
440	quants	noun	plural of quant
441	setmana	noun	week
442	reina	noun	queen; darling
443	fes	adj	cleft, split
444	estimo	verb	first-person singular present indicative of estimar
445	podries	verb	second-person singular conditional of poder
446	cos	noun	body (physical structure of a human or animal); body, corpse
447	ràpid	adj	rapid; quick; fast; speedy
