rank	word	pos	en
4777	sigas	verb	second-person singular present subjunctive of seguir
4778	doloroso	adj	painful
4779	equivoqué	verb	first-person singular preterite indicative of equivocar
4780	cuidando	verb	gerund of cuidar
4781	medicamentos	noun	plural of medicamento
4782	ocuparé	verb	first-person singular future indicative of ocupar
4783	bandas	noun	plural of banda
4784	protocolo	noun	protocol; conduct or etiquette rules
4785	unirse	verb	infinitive of unir combined with se
4786	vosotras	pron	you; second person feminine plural personal pronoun
4787	sufriendo	verb	gerund of sufrir
4788	tomaremos	verb	first-person plural future indicative of tomar
4789	otoño	noun	autumn, fall
4790	estatal	adj	state (country)
4791	candidato	noun	candidate
4792	vencido	adj	defeated, beaten; expired
4793	autor	noun	author; perpetrator of a crime
4794	aérea	adj	feminine singular of aéreo
4795	usaba	verb	first/third-person singular imperfect indicative of usar
4796	comprende	verb	inflection of comprender:; third-person singular present indicative
4797	polla	noun	young hen, pullet; a beverage made with milk, eggs, cinnamon, and, in Mexico, with sherry liquor added; a type of lottery in Chile
4798	huelga	noun	strike, protest (work stoppage)
4799	rabia	noun	rage, anger; rabies
4800	agujeros	noun	plural of agujero
4801	estuviese	verb	first/third-person singular imperfect subjunctive of estar
4802	esperabas	verb	second-person singular imperfect indicative of esperar
4803	jovencita	noun	female equivalent of jovencito: young lady
4804	callado	adj	quiet, silent
4805	encender	verb	to light, ignite; to turn on, switch on, power up; to burn, have a burning sensation
4806	grosero	adj	rude, crass, uncouth, cheeky, fresh, boorish, loutish, coarse
4807	rancho	noun	ranch; shed, barn; mess (mealtime)
4808	conflicto	noun	conflict
4809	conspiración	noun	conspiracy
4810	comando	noun	commando
4811	gota	noun	a drop or small amount of; eyedrops; gout
4812	escenas	noun	plural of escena
4813	colonia	noun	colony; neighbourhood
4814	medalla	noun	medal
4815	contactar	verb	to contact, to reach out to
4816	jugamos	verb	first-person plural present/preterite indicative of jugar
4817	cabra	noun	female goat; goat (unknown gender); girl
4818	traerme	verb	infinitive of traer combined with me
4819	parientes	noun	plural of pariente
4820	creído	adj	big-headed, conceited, stuck up, arrogant, smug
4821	adolescentes	adj	plural of adolescente
4822	llenos	adj	masculine plural of lleno
4823	ultima	verb	inflection of ultimar:; third-person singular present indicative
4824	altas	adj	feminine plural of alto
4825	cambiará	verb	third-person singular future indicative of cambiar
4826	inteligentes	adj	plural of inteligente
4827	dieta	noun	diet (the food and beverages a person or animal consumes); diet (a controlled regimen of food and drink)
4828	quedarás	verb	second-person singular future indicative of quedar
4829	correctamente	adv	correctly
4830	vería	verb	first/third-person singular conditional of ver
4831	suelto	adj	free, loose, undone; isolated, separate; free, agile, fluent
4832	fans	noun	plural of fan
4833	japonés	adj	of Japan; Japanese
4834	ropas	noun	plural of ropa
4835	recibimos	verb	first-person plural present/preterite indicative of recibir
4836	elementos	noun	plural of elemento
4837	verdaderos	adj	masculine plural of verdadero
4838	piensen	verb	inflection of pensar:; third-person plural present subjunctive
4839	pondremos	verb	first-person plural future indicative of poner
4840	contiene	verb	third-person singular present indicative of contener
4841	diciembre	noun	December
4842	motores	adj	masculine plural of motor
4843	estarlo	verb	infinitive of estar combined with lo
4844	preguntarme	verb	infinitive of preguntar combined with me
4845	na	name	abbreviation of Nayarit: a state of Mexico
4846	permanente	adj	permanent
4847	comercio	noun	trade; shop; intercourse (in general or sexual)
4848	llegara	verb	first/third-person singular imperfect subjunctive of llegar
4849	amada	adj	feminine singular of amado
4850	jodidamente	adv	fucking; an intensifier to a phrase
4851	grasa	noun	fat or grease used in cooking; nutritional fat
4852	infección	noun	infection
4853	comenzado	verb	past participle of comenzar
4854	satisfecho	adj	satisfied
4855	presidenta	noun	female equivalent of presidente; president's wife
4856	llevarse	verb	infinitive of llevar combined with se
4857	pesada	noun	female equivalent of pesado
4858	envío	noun	shipment, sending
4859	lea	verb	inflection of leer:; first/third-person singular present subjunctive
4860	desfile	noun	parade
4861	suma	noun	sum; addition
4862	meterse	verb	infinitive of meter combined with se
4863	conclusión	noun	conclusion, end; completion; finding
4864	atrapada	noun	catch
4865	mientes	noun	plural of miente
4866	homicidios	noun	plural of homicidio
4867	cajón	noun	a large box; drawer; cajón (box-shaped percussion instrument)
4868	tragos	noun	plural of trago
4869	salve	intj	hello, hail
4870	valores	noun	plural of valor
4871	leslie	name	a female given name from English
4872	ejecución	noun	execution (the act, manner, or style of executing actions); execution, implementation, implementing (the state of being accomplished); execution (the act of putting to death)
4873	misterioso	adj	mysterious; mystery (e.g. mystery lover [in an affair], mystery man or woman [in a case or investigation]); eerie (e.g. an eerie place, an eerie air or glow, eerie music)
4874	sándwich	noun	sandwich; a sandwich only made with sandwich bread; long weekend; a day which falls between two work-free days (holidays or weekend days), on which leave is preferred
4875	lobos	noun	plural of lobo
4876	fortaleza	noun	fortress; fortitude; strength
4877	furioso	adj	furious, raging; relentless
4878	hamburguesa	noun	hamburger
4879	noel	name	a surname; Noel
4880	barbara	adj	feminine singular of barbaro
4881	salario	noun	wage, wages, salary; income
4882	débiles	adj	plural of débil
4883	plena	adj	feminine singular of pleno
4884	pierda	verb	inflection of perder:; first/third-person singular present subjunctive
4885	cuero	noun	leather; animal skin, hide; football (ball)
4886	jodan	verb	inflection of joder:; third-person plural present subjunctive
4887	oculta	adj	feminine singular of oculto
4888	salvaste	verb	second-person singular preterite indicative of salvar
4889	quema	noun	fire; flame; burning
4890	cometió	verb	third-person singular preterite indicative of cometer
4891	temor	noun	fear; dread; awe; apprehension
4892	nora	name	a female given name
4893	muchísimas	det	feminine plural of muchísimo
4894	bo	intj	hey, mate, dude
4895	comedor	noun	dining room; eatery; cafeteria, canteen (staff restaurant)
4896	aclarar	verb	to clarify, clear (make clear or clearer); to explain; to clarify; to water down
4897	controla	verb	inflection of controlar:; third-person singular present indicative
4898	admito	verb	first-person singular present indicative of admitir
4899	ji	noun	chi; the Greek letter Χ, χ
4900	esconde	verb	inflection of esconder:; third-person singular present indicative
4901	valioso	adj	valuable
4902	aguja	noun	needle; hand (of a clock); firing pin
4903	equivoco	verb	first-person singular present indicative of equivocar
4904	terminaste	verb	second-person singular preterite indicative of terminar
4905	brillantes	adj	plural of brillante
4906	ingleses	adj	masculine plural of inglés
4907	observando	verb	gerund of observar
4908	objetivos	adj	masculine plural of objetivo
4909	casarnos	verb	infinitive of casar combined with nos
4910	emocionada	adj	feminine singular of emocionado
4911	desaparición	noun	disappearance; demise
4912	sello	noun	seal, sigil; stamp (device for stamping designs); stamp (imprint made by stamping)
4913	quietos	adj	masculine plural of quieto
4914	escuelas	noun	plural of escuela
4915	merecía	verb	first/third-person singular imperfect indicative of merecer
4916	deshacerse	verb	infinitive of deshacer combined with se
4917	tiburón	noun	shark; raider, share raider
4918	mostrarle	verb	infinitive of mostrar combined with le
4919	nube	noun	cloud; multitude, or crowd (of people); baby's breath
4920	formación	noun	formation; training, education; alignment (ordered group of people)
4921	compraste	verb	second-person singular preterite indicative of comprar
4922	decepcionado	adj	disappointed, gutted (UK), disillusioned
4923	autopista	noun	motorway, freeway
4924	evidente	adj	obvious, evident, apparent, clear
4925	camiones	noun	plural of camión
4926	programas	noun	plural of programa
4927	falsas	adj	feminine plural of falso
4928	daisy	name	a female given name from English
4929	encuentres	verb	second-person singular present subjunctive of encontrar
4930	matas	noun	plural of mata
4931	quitado	verb	past participle of quitar
4932	actividades	noun	plural of actividad
4933	líderes	noun	plural of líder
4934	escuchad	verb	second-person plural imperative of escuchar
4935	global	adj	global (concerning all parts of the world)
4936	esclavo	noun	slave
4937	ocasiones	noun	plural of ocasión
4938	dejarle	verb	infinitive of dejar combined with le
4939	confirmar	verb	to confirm
4940	pendiente	adj	pending, outstanding, unfinished; hanging; attentive, careful
4941	toalla	noun	towel
4942	creación	noun	creation; invention
4943	raros	adj	masculine plural of raro
4944	novios	noun	plural of novio
4945	escuches	verb	second-person singular present subjunctive of escuchar
4946	temía	verb	first/third-person singular imperfect indicative of temer
4947	detiene	verb	third-person singular present indicative of detener
4948	be	noun	The name of the Latin script letter B/b.
4949	gusano	noun	worm; insect larva, such as a grub, caterpillar, or maggot; worm, low person
4950	atmósfera	noun	atmosphere
4951	reunir	verb	to gather, to collect, to bring together, to assemble, to get together, to round up, to marshal, to compile, to put together, to pull together, to draw together, to pool; to satisfy, to meet, to possess (e.g. conditions, requirements, criteria, qualifications, characteristics); to join, unite
4952	espiritual	adj	spiritual
4953	pensión	noun	guesthouse, boarding house; pension; overnight parking
4954	sirven	verb	third-person plural present indicative of servir
4955	saldremos	verb	first-person plural future indicative of salir
4956	marica	noun	poof; fag; faggot (homosexual man); wimp, weakling; effeminate man
4957	república	noun	republic
4958	siéntense	verb	third-person plural imperative of sentar combined with se
4959	sabio	adj	learned; prudent; wise
4960	increíbles	adj	plural of increíble
4961	embajada	noun	embassy
4962	quieta	adj	feminine singular of quieto
4963	escribo	verb	first-person singular present indicative of escribir
4964	poema	noun	poem (literary piece written in verse)
4965	terminará	verb	third-person singular future indicative of terminar
4966	tenis	noun	tennis
4967	civilización	noun	civilization
4968	patada	noun	kick; electric shock
4969	cuerdas	adj	feminine plural of cuerdo
4970	dibujos	noun	plural of dibujo
4971	perdieron	verb	third-person plural preterite indicative of perder
4972	brenda	name	a female given name from English
4973	tirando	verb	gerund of tirar
4974	miran	verb	third-person plural present indicative of mirar
4975	prometes	verb	second-person singular present indicative of prometer
4976	pluma	noun	feather; quill, quill pen; pen, fountain pen
4977	r	character	The nineteenth letter of the Spanish alphabet, written in the Latin script.
4978	posibles	adj	plural of posible
4979	fallo	noun	mistake; failure; verdict, decision
4980	iris	noun	iris
4981	entendemos	verb	first-person plural present indicative of entender
4982	rodilla	noun	knee (joint or region of the joint in the middle part of the leg between the thigh and the shank)
4983	vestida	adj	feminine singular of vestido
4984	echó	verb	third-person singular preterite indicative of echar
4985	tirador	noun	shooter; rifleman
4986	aparato	noun	apparatus, device, tool, instrument, appliance; blower, piece (phone); braces (a device worn on the teeth to straighten them)
4987	modales	noun	manners (etiquette)
4988	horror	noun	horror; terror
4989	quisiste	verb	second-person singular preterite indicative of querer
4990	pavos	noun	plural of pavo
4991	permitiré	verb	first-person singular future indicative of permitir
4992	estatua	noun	statue
4993	asegurarse	verb	infinitive of asegurar combined with se
4994	regresen	verb	inflection of regresar:; third-person plural present subjunctive
4995	mandado	noun	errand; errand boy, dogsbody, pleb; cock (penis)
4996	continua	adj	feminine singular of continuo
4997	siesta	noun	siesta (a nap, especially an afternoon one taken during the hottest part of the day in some cultures)
4998	ausencia	noun	absence; absence seizure
4999	perdemos	verb	first-person plural present indicative of perder
5000	encontrarán	verb	third-person plural future indicative of encontrar
5001	cuentos	noun	plural of cuento
5002	maletín	noun	briefcase, attaché case
5003	perfume	noun	perfume
5004	grabar	verb	to record; to engrave
5005	crece	verb	inflection of crecer:; third-person singular present indicative
5006	echarle	verb	infinitive of echar combined with le
5007	entro	verb	first-person singular present indicative of entrar
5008	duelo	noun	sorrow; mourning
5009	israel	name	Israel (a country in Western Asia in the Middle East, at the eastern shore of the Mediterranean); Jacob; a male given name from Hebrew, equivalent to English Israel
5010	cometí	verb	first-person singular preterite indicative of cometer
5011	organizar	verb	to organize
5012	pervertido	adj	perverted
5013	subió	verb	third-person singular preterite indicative of subir
5014	revistas	noun	plural of revista
5015	dejarás	verb	second-person singular future indicative of dejar
5016	lleves	verb	second-person singular present subjunctive of llevar
5017	carla	name	a female given name, masculine equivalent Carlos
5018	enciende	verb	inflection of encender:; third-person singular present indicative
5019	quitó	verb	third-person singular preterite indicative of quitar
5020	radar	noun	radar; speed camera
5021	seriamente	adv	seriously
5022	probabilidades	noun	plural of probabilidad
5023	capullo	noun	cocoon; bud, blossom (especially used for rosebuds); pod
5024	deseando	verb	gerund of desear
5025	dana	noun	alternative letter-case form of DANA
5026	habrás	verb	second-person singular future indicative of haber
5027	ganaste	verb	second-person singular preterite indicative of ganar
5028	locas	adj	feminine plural of loco
5029	hall	noun	hall, lobby, lounge
5030	encantó	verb	third-person singular preterite indicative of encantar
5031	telefónica	adj	feminine singular of telefónico
5032	llegues	noun	plural of llegue
5033	micrófono	noun	microphone
5034	margen	noun	margin, edge; leeway
5035	gesto	noun	gesture; expression
5036	cintas	noun	plural of cinta
5037	sugiere	verb	inflection of sugerir:; third-person singular present indicative
5038	embarazo	noun	pregnancy, childbearing; inconvenience, obstacle; awkwardness in actions or conduct
5039	encaja	verb	inflection of encajar:; third-person singular present indicative
5040	consuelo	noun	solace; consolation
5041	llamarla	verb	infinitive of llamar combined with la
5042	sabiduría	noun	wisdom; learning; knowledge
5043	sincera	adj	feminine singular of sincero
5044	bolsillos	noun	plural of bolsillo
5045	paula	name	a female given name
5046	comencé	verb	first-person singular preterite indicative of comenzar
5047	muestran	verb	third-person plural present indicative of mostrar
5048	mágica	noun	magic
5049	terriblemente	adv	terribly
5050	recuerdan	verb	third-person plural present indicative of recordar
5051	solíamos	verb	first-person plural imperfect indicative of soler
5052	susto	noun	fright
5053	ocurrirá	verb	third-person singular future indicative of ocurrir
5054	hadas	noun	plural of hada
5055	sos	verb	second-person singular voseo present indicative of ser
5056	preocuparme	verb	infinitive of preocupar combined with me
5057	vidrio	noun	glass (substance); window
5058	término	noun	end, terminus (the terminal point of something in space or time); end, finish, conclusion (the cessation of an effort, activity, state, or motion); term, period (a chronological limitation or restriction, a limited timespan)
5059	volverán	verb	third-person plural future indicative of volver
5060	desorden	noun	disorder; untidiness
5061	alimentar	verb	to feed (give food to eat); to feed into, reinforce.
5062	boleto	noun	ticket; lie, untruth
5063	lavado	noun	laundry, laundering; washing, wash
5064	confusión	noun	confusion
5065	ave	noun	bird; fowl, poultry
5066	cambié	verb	first-person singular preterite indicative of cambiar
5067	temer	verb	to fear; to dread; to be afraid, sorry; to suspect
5068	danos	verb	inflection of dar:; second-person singular imperative combined with nos
5069	facultad	noun	school, college, department; power, authority, right; ability, gift
5070	mochila	noun	backpack; schoolbag; satchel
5071	satélite	noun	satellite
5072	independiente	adj	independent (not contingent or depending on something else); independent, autonomous
5073	intentan	verb	third-person plural present indicative of intentar
5074	enero	noun	January
5075	busqué	verb	first-person singular preterite indicative of buscar
5076	diosa	noun	goddess
5077	estuvieran	verb	third-person plural imperfect subjunctive of estar
5078	barón	noun	baron (male ruler of a barony); baron, bigwig (person of great power in society, especially in business and politics)
5079	artes	noun	plural of arte
5080	nocturno	adj	night; nocturnal
5081	timbre	noun	bell; doorbell; timbre
5082	escapa	verb	inflection of escapar:; third-person singular present indicative
5083	establecer	verb	to establish; to set
5084	duermo	verb	first-person singular present indicative of dormir
5085	araña	noun	spider; chandelier
5086	detenga	verb	inflection of detener:; first/third-person singular present subjunctive
5087	intentes	verb	second-person singular present subjunctive of intentar
5088	correos	noun	post office
5089	profesores	noun	plural of profesor
5090	enseñarle	verb	infinitive of enseñar combined with le
5091	guerreros	adj	masculine plural of guerrero
5092	ancianos	adj	masculine plural of anciano
5093	preocupo	verb	first-person singular present indicative of preocupar
5094	bebes	noun	plural of bebe
5095	imaginaba	verb	first/third-person singular imperfect indicative of imaginar
5096	mundos	noun	plural of mundo
5097	martillo	noun	hammer (a tool with a heavy head and a handle used for pounding); malleus; auction house
5098	eterna	adj	feminine singular of eterno
5099	sufrió	verb	third-person singular preterite indicative of sufrir
5100	comentario	noun	comment; commentary
5101	inicio	noun	start, initiation; home (software term)
5102	buscarme	verb	infinitive of buscar combined with me
5103	impresionado	adj	impressed
5104	estelar	adj	star; stellar (of or relating to stars); stellar, extraordinary, outstanding
5105	pagas	noun	plural of paga
5106	álbum	noun	album (a book designed to keep photographs, stamps, autographs); album (a phonograph record composed of several tracks)
5107	rojos	adj	masculine plural of rojo
5108	jueces	noun	plural of juez (“judges”)
5109	sufre	verb	inflection of sufrir:; third-person singular present indicative
5110	internos	adj	masculine plural of interno
5111	casé	verb	first-person singular preterite indicative of casar
5112	teresa	name	a female given name, equivalent to English Teresa
5113	pudieran	verb	third-person plural imperfect subjunctive of poder; third-person plural imperfect subjunctive of pudir
5114	ola	noun	wave (on the surface of a liquid); sudden appearance of a large amount of something; Mexican wave
5115	equivoca	verb	inflection of equivocar:; third-person singular present indicative
5116	desaparecida	noun	female equivalent of desaparecido
5117	retrato	noun	portrait; portraiture; portrayal
5118	justa	noun	tournament; joust; jousting (often in the plural)
5119	repugnante	adj	repugnant, repulsive, rebarbative, abhorrent, ugly, hideous, obnoxious; disgusting, revolting, loathsome, sickening, gross, nasty, foul, vile, nauseating, repellent
5120	mentirosa	noun	female equivalent of mentiroso
5121	mirado	verb	past participle of mirar
5122	confesar	verb	to confess, to come clean about; to confess, to come clean; to hear confession
5123	vacas	adj	feminine plural of vaco
5124	deberá	verb	third-person singular future indicative of deber
5125	rojas	adj	feminine plural of rojo
5126	repetir	verb	to repeat (to do or say again (and again)); to repeat; to take seconds (meal); to repeat oneself (to echo the words of (a person))
5127	respiro	noun	breath; break, respite, breather, relief, reprieve, rest; breathing room, breathing space, slack
5128	cuya	det	feminine singular of cuyo
5129	ganancias	noun	plural of ganancia
5130	disfrutando	verb	gerund of disfrutar
5131	comedia	noun	comedy; comedy (entertainment); soap opera
5132	boy	noun	a male stripper
5133	chip	noun	chip (circuit)
5134	amables	adj	plural of amable
5135	inversión	noun	investment; inversion
5136	gemelos	adj	masculine plural of gemelo
5137	minas	noun	plural of mina
5138	falsos	adj	masculine plural of falso
5139	times	verb	second-person singular present subjunctive of timar
5140	matarnos	verb	infinitive of matar combined with nos
5141	cogí	verb	first-person singular preterite indicative of coger
5142	australia	name	Australia (a country consisting of a main island, the island of Tasmania and other smaller islands, located in Oceania; historically, a collection of former colonies of the British Empire); Australia (a continent consisting of the land on the Australian tectonic plate, i.e. Australia, New Guinea and intervening islands)
5143	seda	noun	silk (fine fiber excreted by the silkworm or other arthropod); silk (fine, soft cloth woven from silk fibers); thin string (long, very thin, and flexible structure made from threads twisted together)
5144	malentendido	noun	misunderstanding
5145	distintas	adj	feminine plural of distinto
5146	diamante	noun	diamond; diamond (a playing card of the suit diamonds, diamantes)
5147	cojo	adj	lame, crippled; lame, defective, shaky
5148	avergonzado	adj	embarrassed, ashamed
5149	siguientes	adj	plural of siguiente
5150	agarrar	verb	to grab or take hold of; to hold on; to catch (an illness, feeling etc.)
5151	comunicaciones	noun	plural of comunicación
5152	dirán	verb	third-person plural future indicative of decir
5153	cobrar	verb	to charge (money, etc.); to collect; to gather up (strength, bravery etc.)
5154	dificultades	noun	plural of dificultad
5155	lápiz	noun	pencil
5156	pague	verb	inflection of pagar:; first/third-person singular present subjunctive
5157	caiga	verb	inflection of caer:; first/third-person singular present subjunctive
5158	tara	noun	tare (empty weight of a container); defect, flaw, vice; deficiency
5159	avenida	noun	avenue; flood
5160	comenzamos	verb	first-person plural present/preterite indicative of comenzar
5161	seca	adj	feminine singular of seco
5162	contentos	adj	masculine plural of contento
5163	vivió	verb	third-person singular preterite indicative of vivir
5164	hágalo	verb	third-person singular imperative of hacer combined with lo
5165	bruno	adj	dark brown; black
5166	llévate	verb	second-person singular imperative of llevar combined with te
5167	oculto	adj	occult; hidden, secret
5168	metes	verb	second-person singular present indicative of meter
5169	principales	adj	plural of principal
5170	mario	name	a male given name, equivalent to English Marius
5171	euros	noun	plural of euro
5172	salva	noun	salvo, volley
5173	mantengan	verb	inflection of mantener:; third-person plural present subjunctive
5174	entras	verb	second-person singular present indicative of entrar
5175	promesas	noun	plural of promesa
5176	explosivos	adj	masculine plural of explosivo
5177	ataúd	noun	coffin, casket; a metal or (lined) wooden oven for roasting or smoking food outdoors (compare caja china)
5178	cancelar	verb	to cancel, call off; to cancel (a person deemed unacceptable); to forget about; to scrap
5179	excusas	noun	plural of excusa
5180	emergencias	noun	plural of emergencia
5181	orgullosos	adj	masculine plural of orgulloso
5182	creerme	verb	infinitive of creer combined with me
5183	seguida	adj	feminine singular of seguido
5184	busque	verb	inflection of buscar:; first/third-person singular present subjunctive
5185	encendido	adj	on, activated; burning; passionate
5186	coro	noun	choir; chorus (of a song); choir (area where singers in a church stand)
5187	urgencias	noun	plural of urgencia; emergency room
5188	tales	name	Thales (philosopher)
5189	observa	verb	inflection of observar:; third-person singular present indicative
5190	manual	adj	manual (performed by the hands); manual (operated by the hands); manual (performed by a human)
5191	privacidad	noun	privacy
5192	ll	character	The fourteenth letter of the Spanish alphabet, written in the Latin script; preceded by l and followed by m.
5193	pasaré	verb	first-person singular future indicative of pasar
5194	recuperación	noun	retrieval; recovery
5195	cuartos	noun	quarter finals, quarterfinals
5196	semejante	adj	similar; such; what a (when followed by a noun)
5197	sobra	noun	surplus, excess, extra; plentifulness; leftovers, leavings; rubbish, trash
5198	oler	verb	to smell (perceive by scent); to pry into, investigate (make inquiries where one is not welcome); to smell out, uncover (find out by prying)
5199	presentado	adj	presented; submitted; filed, lodged
5200	basado	verb	past participle of basar
5201	paro	noun	stop, stagnation (action of stopping); unemployment; strike (work stoppage)
