rank	word	pos	en
2321	bola	noun	ball; testicle; scoop
2322	canciones	noun	plural of canción
2323	mataré	verb	first-person singular future indicative of matar
2324	muchísimo	det	superlative degree of mucho: much, a great deal, a lot
2325	asistente	noun	attendee; assistant
2326	llegaron	verb	third-person plural preterite indicative of llegar
2327	correcta	adj	feminine singular of correcto
2328	pondré	verb	first-person singular future indicative of poner
2329	comido	adj	having had lunch; having already eaten
2330	salgan	verb	inflection of salir:; third-person plural present subjunctive
2331	empecé	verb	first-person singular preterite indicative of empezar
2332	tirar	verb	to drop intentionally; to throw, to toss; to throw out, to toss, to dump
2333	pasan	verb	third-person plural present indicative of pasar
2334	cierta	adj	feminine singular of cierto
2335	honesto	adj	honest; honorable
2336	carro	noun	cart; car, automobile (used especially in Central America, the Caribbean, Colombia, Peru, Ecuador, Venezuela and Mexico); a bus or minivan used on public transportation to carry passengers from one part of a city to another (while it has the same meaning as 'auto', 'carro' is preferred when referring to public transportation automobiles)
2337	limpia	noun	cleansing, cleaning
2338	volví	verb	first-person singular preterite indicative of volver
2339	confío	verb	first-person singular present indicative of confiar
2340	venta	noun	sale; sales (all goods sold in a given time period); roadside inn in Spain
2341	huir	verb	to flee, to run away; to escape; to avoid
2342	apareció	verb	third-person singular preterite indicative of aparecer
2343	compromiso	noun	commitment; engagement, appointment; compromise
2344	gustas	verb	second-person singular present indicative of gustar
2345	aseguro	verb	first-person singular present indicative of asegurar
2346	ira	noun	anger, ire; wrath, rage
2347	promesa	noun	promise
2348	decírselo	verb	infinitive of decir combined with indirect object le/les and direct object lo
2349	cuáles	pron	plural of cuál
2350	compras	noun	plural of compra
2351	importancia	noun	importance
2352	lección	noun	lesson (a section of learning or teaching); lesson (something to learn or be learned); lesson (something that serves as a warning or encouragement)
2353	hablaré	verb	first-person singular future indicative of hablar
2354	hacerse	verb	infinitive of hacer combined with se
2355	personalmente	adv	personally
2356	bolsillo	noun	pocket; pocketbook (personal resources)
2357	enojado	adj	angry, mad; annoyed; enraged
2358	desgracia	noun	disgrace; misfortune, bad luck; accident, disaster
2359	artículo	noun	article; article (in a dictionary, encyclopedia etc.)
2360	labios	noun	plural of labio
2361	cola	noun	tail; line (US), queue (UK); empennage, aircraft tail
2362	estemos	verb	inflection of estar:; first-person plural present subjunctive
2363	whisky	noun	whisky (alcoholic liquor)
2364	taza	noun	cup, mug; toilet bowl
2365	preguntarte	verb	infinitive of preguntar combined with te
2366	pelota	noun	ball (a round or ellipsoidal object); ball game; testicle
2367	caminando	verb	gerund of caminar
2368	andar	verb	to walk, to go; to amble, to travel; to ride
2369	crea	verb	inflection of crear:; third-person singular present indicative
2370	chaqueta	noun	jacket, piece of clothing worn on the upper body outside a shirt or blouse, often waist length to thigh length
2371	importaría	verb	first/third-person singular conditional of importar
2372	den	verb	inflection of dar:; third-person plural present subjunctive
2373	llegará	verb	third-person singular future indicative of llegar
2374	interesado	adj	interested; acquisitive, grabby; opportunistic
2375	atrapado	adj	caught, captured, trapped, stuck; caught up in
2376	supiera	verb	first/third-person singular imperfect subjunctive of saber
2377	matarlo	verb	infinitive of matar combined with lo
2378	árboles	noun	plural of árbol
2379	obvio	adj	obvious; clear
2380	amaba	verb	first/third-person singular imperfect indicative of amar
2381	hablaremos	verb	first-person plural future indicative of hablar
2382	entrenamiento	noun	training, workout
2383	pescado	noun	dead fish intended for consumption; food fish; fish
2384	últimas	adj	feminine plural of último
2385	pobres	adj	plural of pobre
2386	dioses	noun	plural of dios
2387	nerviosa	adj	feminine singular of nervioso
2388	vueltas	noun	plural of vuelta; go-back
2389	deme	verb	third-person singular imperative of dar combined with me
2390	encontrarlo	verb	infinitive of encontrar combined with lo
2391	autos	noun	plural of auto
2392	preguntarle	verb	infinitive of preguntar combined with le
2393	abrigo	noun	overcoat; warm clothes; shelter
2394	okay	intj	alternative form of OK
2395	estudiar	verb	to study; to examine, look into
2396	b	character	The second letter of the Spanish alphabet, called be and written in the Latin script.
2397	sonrisa	noun	smile
2398	cobarde	adj	cowardly, craven, gutless, spineless, dastardly; yellow (easily frightened)
2399	olvida	verb	inflection of olvidar:; third-person singular present indicative
2400	secundaria	noun	secondary school, high school
2401	descubierto	adj	discovered
2402	convirtió	verb	third-person singular preterite indicative of convertir
2403	coches	noun	plural of coche
2404	venía	verb	first/third-person singular imperfect indicative of venir
2405	charla	noun	talk, chat
2406	vives	verb	second-person singular present subjunctive of vivar; second-person singular present indicative of vivir
2407	bruja	noun	witch, sorceress (woman who practices witchcraft); specifically, a Wiccan; crone, hag (ugly, evil-looking, or frightening old woman)
2408	c	character	The third letter of the Spanish alphabet, written in the Latin script.
2409	celular	adj	cellular
2410	rompió	verb	third-person singular preterite indicative of romper
2411	andando	verb	gerund of andar
2412	vean	verb	inflection of ver:; third-person plural present subjunctive
2413	conseguiste	verb	second-person singular preterite indicative of conseguir
2414	veinte	num	twenty
2415	encargo	noun	order (a product that is ordered); errand, task; commission, assignment, job (an order at work from one's boss)
2416	matarte	verb	infinitive of matar combined with te
2417	palacio	noun	palace; mansion
2418	convierte	verb	inflection of convertir:; third-person singular present indicative
2419	ja	intj	representation of laughter, ha
2420	vivos	adj	masculine plural of vivo
2421	pasamos	verb	first-person plural present/preterite indicative of pasar
2422	firme	adj	firm, steady, secure; steadfast, unwavering, unswerving, firm; adamant
2423	daría	verb	first/third-person singular conditional of dar
2424	piense	verb	inflection of pensar:; first/third-person singular present subjunctive
2425	oigo	verb	first-person singular present indicative of oír
2426	sorprende	verb	inflection of sorprender:; third-person singular present indicative
2427	alemanes	adj	masculine plural of alemán
2428	milagro	noun	miracle; wonder, very unusual event
2429	soportar	verb	to bear, to endure, to withstand, put up with, tolerate, to stomach, to weather, to handle; to support a weight or load
2430	dejaron	verb	third-person plural preterite indicative of dejar
2431	disculpen	verb	inflection of disculpar:; third-person plural present subjunctive
2432	moda	noun	fashion; fad; mode
2433	despacho	noun	dispatch; office
2434	vecinos	adj	masculine plural of vecino
2435	vaso	noun	drinking glass; glassful; vessel (container)
2436	dejarte	verb	infinitive of dejar combined with te
2437	explosión	noun	explosion, blast, bang, burst, boom; bang, boom
2438	poderes	noun	plural of poder
2439	regla	noun	rule (regulation, norm); ruler (measuring stick); menstruation, period
2440	acaban	verb	third-person plural present indicative of acabar
2441	copia	noun	copy (a duplicate of an original); abundance
2442	siguiendo	verb	gerund of seguir
2443	viajar	verb	to travel, journey
2444	cadena	noun	chain (series of interconnected rings or links usually made of metal); necklace (article of jewelry that is worn around the neck); network (group of affiliated television stations)
2445	fábrica	noun	factory
2446	mantiene	verb	third-person singular present indicative of mantener
2447	meter	verb	to put in, insert; to score; to make (noise)
2448	contenta	adj	feminine singular of contento
2449	comiendo	verb	gerund of comer
2450	educación	noun	education; upbringing; manners, etiquette
2451	maneras	noun	plural of manera
2452	fumar	verb	to smoke (give off smoke); to smoke (inhale and exhale tobacco smoke); to smoke (inhale and exhale the smoke from a burning cigarette, cigar, pipe, etc.)
2453	encantador	adj	charming, captivating, enchanting, lovely; delightful, lovely; winsome
2454	cuantos	det	masculine plural of cuanto
2455	homicidio	noun	homicide; manslaughter
2456	madera	noun	wood; wooden plank, board; makings
2457	mayores	adj	plural of mayor
2458	grado	noun	degree; grade; level
2459	tratamiento	noun	treatment (the process or manner of treating someone or something); treatment (medical care for an illness or injury); term of address
2460	blancos	adj	masculine plural of blanco
2461	lord	noun	lord (British title)
2462	anterior	adj	anterior (in time), previous, earlier, former, past; anterior (in space)
2463	comisario	noun	inspector; commissioner; steward
2464	pizza	noun	pizza (Italian dish)
2465	millas	noun	plural of milla
2466	tira	noun	tie, ribbon; strip
2467	fueran	verb	third-person plural imperfect subjunctive of ir; third-person plural imperfect subjunctive of ser
2468	cumplir	verb	to fulfil, to fulfill, to meet, to deliver (e.g., requirements, prerequisites, promise, vow); to achieve, to accomplish, to carry out, to perform, to complete, to discharge, to fulfil (e.g., one's duties, responsibilities); to turn a certain age (may be succeeded by los)
2469	plata	adj	argent
2470	quedará	verb	third-person singular future indicative of quedar
2471	quedaré	verb	first-person singular future indicative of quedar
2472	aléjate	verb	second-person singular imperative of alejar combined with te
2473	decidir	verb	to decide, to make up one's mind, to determine, to choose to; to decide on; to rule
2474	lío	noun	bundle; trouble, hassle, problem, mess, pickle; lover, bit on the side
2475	preguntó	verb	third-person singular preterite indicative of preguntar
2476	agencia	noun	agency (the office or function of an agent); agency (an establishment engaged in doing business for another); branch (a location of an organization)
2477	humanidad	noun	humanity
2478	usado	adj	used; worn, worn-out
2479	guardias	noun	plural of guardia
2480	parada	noun	stop (the act of stopping); station (a location where things stop); (football) stop, (baseball) catch
2481	leyes	noun	plural of ley
2482	funcionó	verb	third-person singular preterite indicative of funcionar
2483	odia	verb	inflection of odiar:; third-person singular present indicative
2484	levanta	verb	inflection of levantar:; third-person singular present indicative
2485	mires	noun	masculine/feminine plural of mir
2486	respira	verb	inflection of respirar:; third-person singular present indicative
2487	escaleras	noun	plural of escalera
2488	decisiones	noun	plural of decisión
2489	queréis	verb	second-person plural present indicative of querer
2490	salvaje	adj	wild, savage (untamed, not domesticated); savage, feral, uncivilized (said of a person)
2491	preguntando	verb	gerund of preguntar
2492	pasos	adj	masculine plural of paso
2493	ambulancia	noun	ambulance (an emergency vehicle designed for transporting seriously ill or injured people to a hospital)
2494	traducción	noun	translation
2495	trabajado	verb	past participle of trabajar
2496	básicamente	adv	basically
2497	tratado	noun	treaty
2498	parado	adj	stopped, halted, immobile, idle; standing; unemployed; on the dole
2499	especiales	adj	plural of especial
2500	mentiroso	adj	having the qualities of a liar; having lies
2501	libres	adj	plural of libre
2502	servicios	noun	plural of servicio
2503	pedirle	verb	infinitive of pedir combined with le
2504	vivía	verb	first/third-person singular imperfect indicative of vivir
2505	medios	adj	masculine plural of medio
2506	compra	noun	purchase, buying; acquisition
2507	conocimiento	noun	knowledge; awareness (state of knowing something); consciousness (state of having cognition and sensation)
2508	armario	noun	storage cabinet, wardrobe, cupboard; wardrobe, closet (movable furniture for storing clothes); locker
2509	lobo	noun	wolf (wild Canis lupus); drunkenness
2510	quedamos	verb	first-person plural present/preterite indicative of quedar
2511	ciertamente	adv	certainly
2512	permitir	verb	to allow, permit; to afford, to allow; to indulge in
2513	tráfico	noun	traffic; smuggle
2514	uniforme	adj	uniform, even
2515	estuvimos	verb	first-person plural preterite indicative of estar
2516	alemania	name	Germany (a nation or civilization occupying the country around the Rhine, Elbe, and upper Danube Rivers in Central Europe, taken as a whole under its various governments); Germany (a country in Central Europe, formed in 1949 as West Germany, with its provisional capital Bonn until 1990, when it incorporated East Germany)
2517	suave	adj	smooth, soft, fluffy; soft, gentle, light, mild (e.g. mild flavor, a mild winter); suave (charming, confident and elegant)
2518	propias	adj	feminine plural of propio
2519	balas	noun	plural of bala
2520	asqueroso	adj	disgusting, repulsive, gross, distasteful
2521	ciento	num	one hundred (100) (only in compounds followed by lower numerals)
2522	invierno	noun	winter
2523	consigo	adv	with himself, herself, itself, themselves
2524	encuentre	verb	inflection of encontrar:; first/third-person singular present subjunctive
2525	conductor	noun	driver; motorist; presenter; host (of a television show)
2526	equipos	noun	plural of equipo
2527	arena	noun	sand, gravel; bullfight arena; boxing ring
2528	licencia	noun	license; permission; leave (absence from work)
2529	tíos	noun	plural of tío
2530	dijera	verb	first/third-person singular imperfect subjunctive of decir
2531	espejo	noun	mirror
2532	marina	noun	navy
2533	matando	verb	gerund of matar
2534	seres	noun	plural of ser
2535	fiestas	noun	plural of fiesta
2536	mover	verb	to move (to cause to change place or posture); to shake (e.g. to shake one's head, to shake one's tail feather); to wiggle (e.g. one's ears, fingers, nose, toes)
2537	coincidencia	noun	coincidence; agreement; match
2538	análisis	noun	analysis (decomposition into parts); analysis (the result of such a decomposition); analysis
2539	llegando	verb	gerund of llegar
2540	azúcar	noun	sugar
2541	casar	verb	to marry, wed someone to (unite two others in wedlock); to marry off; to match (up), fit (together)
2542	sótano	noun	cellar; basement; pit
2543	volvamos	verb	inflection of volver:; first-person plural present subjunctive
2544	sabrá	verb	third-person singular future indicative of saber
2545	ocasión	noun	occasion
2546	cheque	noun	cheque, blank cheque; checkmark; check valve
2547	revisar	verb	to revise; to review, to check
2548	ponerme	verb	infinitive of poner combined with me
2549	suceder	verb	to happen, to befall, to occur; to succeed to, to follow; to succeed, to triumph
2550	acusado	adj	accused; marked; pronounced
2551	dímelo	verb	second-person singular imperative of decir combined with indirect object me and direct object lo
2552	quedé	verb	first-person singular preterite indicative of quedar
2553	conciencia	noun	awareness (state of knowing something); consciousness (state of having cognition and sensation); conscience, morals
2554	pesadilla	noun	nightmare; bane
2555	sopa	noun	soup (any of various dishes commonly made by combining liquids, such as water or stock, with other ingredients, such as meat and vegetables, that contribute the food value, flavor, and texture); noodles; sopped bread
2556	saltar	verb	to jump; to skip; miss (a meal etc.); to sauté
2557	heridas	adj	feminine plural of herido
2558	pienses	verb	second-person singular present subjunctive of pensar
2559	suicidio	noun	suicide (the act of killing oneself)
2560	llamarme	verb	infinitive of llamar combined with me
2561	posibilidades	noun	plural of posibilidad
2562	elegido	noun	chosenness, selectness
2563	divorcio	noun	divorce (the legal dissolution of a marriage); divorce (a separation of connected things)
2564	registros	noun	plural of registro
2565	recibí	verb	inflection of recibir:; first-person singular preterite indicative
2566	escuchas	noun	plural of escucha
2567	mirad	verb	second-person plural imperative of mirar
2568	pierde	verb	inflection of perder:; third-person singular present indicative
2569	abogados	noun	plural of abogado
2570	trataba	verb	first/third-person singular imperfect indicative of tratar
2571	americanos	adj	masculine plural of americano
2572	llevando	verb	gerund of llevar
2573	miel	noun	honey
2574	regrese	verb	inflection of regresar:; first/third-person singular present subjunctive
2575	dilo	verb	second-person singular imperative of decir combined with lo
2576	hermanas	noun	plural of hermana
2577	alemán	adj	German (of, from or relating to Germany); German (relating to the German language)
2578	iría	verb	first/third-person singular conditional of ir
2579	lady	noun	lady (wife of a lord; important woman)
2580	salí	verb	inflection of salir:; first-person singular preterite indicative
2581	particular	adj	specific, particular; peculiar, strange; personal
2582	miras	noun	plural of mira
2583	frontera	noun	border, frontier; demarcation
2584	ventaja	noun	advantage, upper hand, edge; head start; benefit
2585	alerta	adj	alert, vigilant
2586	piscina	noun	swimming pool; fishpond; piscina
2587	regalos	noun	plural of regalo
2588	comportamiento	noun	behavior
2589	julia	name	a female given name from Latin, equivalent to English Julia
2590	señales	noun	plural of señal
2591	salimos	verb	first-person plural present/preterite indicative of salir
2592	revista	noun	magazine; revue
2593	ma	noun	mum; mom
2594	hecha	noun	obsolete spelling of fecha (“date”); deed
2595	imágenes	noun	plural of imagen
2596	llegas	verb	second-person singular present indicative of llegar
2597	rápida	adj	feminine singular of rápido
2598	canal	noun	canal, flume, waterway (artificial); channel (wide strait); channel
2599	paciencia	noun	patience, forbearance (the quality of being patient)
2600	sacado	verb	past participle of sacar
2601	echo	noun	throw
2602	crisis	noun	crisis; attack; fit
2603	asesinos	adj	masculine plural of asesino
2604	oíste	verb	second-person singular preterite indicative of oír
2605	dejando	verb	gerund of dejar
2606	estarías	verb	second-person singular conditional of estar
2607	anteriormente	adv	previously
2608	vigilancia	noun	vigilance, watchfulness (the state or quality of being watchful; alertness, vigilance or wakefulness); surveillance, security (close observation of an individual or group; person or persons under suspicion)
2609	desierto	adj	desert; empty (of people); uninhabited
2610	asustada	adj	feminine singular of asustado
2611	cuerda	adj	feminine singular of cuerdo
2612	míos	det	masculine plural of mío (“mine, my”)
2613	seguido	adv	often
2614	seremos	verb	first-person plural future indicative of ser
2615	pene	noun	penis
2616	despierto	verb	first-person singular present indicative of despertar
2617	gobernador	noun	governor
2618	sección	noun	section; piece, part; department
2619	casarme	verb	infinitive of casar combined with me
2620	trabajos	noun	plural of trabajo
2621	preparados	adj	masculine plural of preparado
2622	murieron	verb	third-person plural preterite indicative of morir
2623	oso	noun	bear (in general); boar, male bear; bear (large hairy man, especially homosexual)
2624	curiosidad	noun	curiosity
2625	vd.	pron	abbreviation of usted
2626	impresión	noun	impression; print; shock
2627	pez	noun	fish (especially if alive or not intended for consumption); idiot, dimwit
2628	pasaba	verb	first/third-person singular imperfect indicative of pasar
2629	escuchaste	verb	second-person singular preterite indicative of escuchar
2630	torre	noun	tower; rook; skyscraper (high building)
2631	sientas	verb	second-person singular present indicative of sentar
2632	mentir	verb	to lie (say something untrue)
2633	pasillo	noun	hallway, corridor; aisle; pasillo
2634	juega	verb	inflection of jugar:; third-person singular present indicative
2635	suéltame	verb	second-person singular imperative of soltar combined with me
2636	arresto	noun	arrest; boldness
2637	ricos	adj	masculine plural of rico
2638	sencillo	adj	plain; simple, straightforward
2639	ruta	noun	highway; route; path
2640	documentos	noun	plural of documento
2641	enamorada	noun	female equivalent of enamorado
2642	apuesta	noun	bet, wager (an agreement between two parties that a stake (usually money) will be paid by the loser to the winner)
2643	perdida	adj	feminine singular of perdido
2644	vinieron	verb	third-person plural preterite indicative of venir
2645	ayudarnos	verb	infinitive of ayudar combined with nos
2646	presento	verb	first-person singular present indicative of presentar
2647	hazme	verb	second-person singular imperative of hacer combined with me
2648	leí	verb	first-person singular preterite indicative of leer
2649	virus	noun	virus; computer virus
2650	lárgate	verb	second-person singular imperative of largar combined with te
2651	sigan	verb	inflection of seguir:; third-person plural present subjunctive
2652	compró	verb	third-person singular preterite indicative of comprar
2653	servir	verb	to serve (to be a servant or worker; to render service); to serve (to be a servant for; to work for); to be of use, to be good for
2654	pongas	verb	second-person singular present subjunctive of poner
2655	alarma	noun	alarm (a summons to arms); alarm (a sound intended to give notice of approaching danger); alarm (a mechanical device for rousing attention)
2656	identidad	noun	identity
2657	iguales	adj	plural of igual
2658	aviso	noun	warning; announcement
2659	aprendido	verb	past participle of aprender
2660	caza	noun	hunting, hunt (act of finding and killing a wild animal; art of hunting); persecution, hunting (act of pursuing in a manner to injure, grieve, or afflict); game (wild animals hunted for food; meat of these animals)
2661	daba	verb	first/third-person singular imperfect indicative of dar
2662	muchacha	noun	female equivalent of muchacho: girl, young lady
2663	permanecer	verb	to stay, remain, stand
2664	bebés	noun	plural of bebé
2665	opciones	noun	plural of opción
2666	responde	verb	inflection of responder:; third-person singular present indicative
2667	vernos	verb	infinitive of ver combined with nos
2668	llamaste	verb	second-person singular preterite indicative of llamar
2669	ponerse	verb	infinitive of poner combined with se
2670	sacó	verb	third-person singular preterite indicative of sacar
2671	orgullo	noun	pride (arrogance, haughtiness); pride (sense of self-worth); pride (something of which one is proud)
2672	reales	adj	plural of real
2673	esperan	verb	third-person plural present indicative of esperar
2674	vuelves	verb	second-person singular present indicative of volver
2675	serlo	verb	infinitive of ser combined with lo
2676	cuantas	det	feminine plural of cuanto
2677	enfadado	adj	angry, irate
2678	ponen	verb	third-person plural present indicative of poner
2679	altura	noun	height; altitude; heaven
2680	archivo	noun	archive; file; filing cabinet
2681	ayudará	verb	third-person singular future indicative of ayudar
2682	fácilmente	adv	easily
2683	criatura	noun	creature (living being), critter; small child, infant
2684	saco	noun	bag, sack (a loose container); gunny sack; suit jacket (jacket portion of a formal suit)
2685	precisamente	adv	precisely
2686	máximo	name	a male given name from Latin
2687	viniendo	verb	gerund of venir
2688	vendría	verb	first/third-person singular conditional of venir
2689	ilegal	adj	illegal, unlawful
2690	refiere	verb	inflection of referir:; third-person singular present indicative
2691	llamamos	verb	first-person plural present/preterite indicative of llamar
2692	versión	noun	version; cover version
2693	incendio	noun	fire (especially burning buildings or forests); blaze; outburst
2694	preferiría	verb	first/third-person singular conditional of preferir
2695	gritar	verb	to shout, to scream, to cry out, to call out; to jeer at
2696	recibió	verb	third-person singular preterite indicative of recebir; third-person singular preterite indicative of recibir
2697	concierto	noun	concert; concerto
2698	casualidad	noun	chance, coincidence, happenstance, fluke, accident
2699	excusa	noun	excuse, cop-out; pretext
2700	rodillas	noun	plural of rodilla
2701	cruz	noun	cross; torture; misery
2702	dulces	adj	plural of dulce
2703	zorra	noun	slut, prostitute; bitch (despicable or disagreeable, aggressive person, usually a woman); an attractive woman
2704	cómodo	adj	comfortable; convenient; lazy
2705	cruel	adj	cruel; mean
2706	sofá	noun	sofa, couch
2707	perdiste	verb	second-person singular preterite indicative of perder
2708	encantadora	noun	female equivalent of encantador
2709	salgamos	verb	inflection of salir:; first-person plural present subjunctive
2710	sombra	noun	shadow (a dark image projected onto a surface where light (or other radiation) is blocked by the shade of an object); shade (darkness where light, particularly sunlight, is blocked); shade, shadow (a small degree)
2711	ganó	verb	third-person singular preterite indicative of ganar
2712	encantada	adj	feminine singular of encantado
2713	firmar	verb	to sign
