rank	word	pos	en
1	de	noun	The name of the Latin script letter D/d.
2	que	conj	that; than; indicates reason; because, for
3	no	noun	abbreviation of noroeste; northwest
4	a	character	The first letter of the Spanish alphabet, written in the Latin script.
5	la	article	feminine singular definite article; the
6	el	article	masculine singular definite article; the
7	y	character	The twenty-sixth letter of the Spanish alphabet, called ye or i griega and written in the Latin script.
8	es	verb	third-person singular present indicative of ser
9	en	prep	in, at, on; in (a time); in (a language)
10	lo	pron	accusative of él and usted (when referring to a man), and a variant of ello in many constructions; him, you (formal), it, that
11	un	article	an; a
12	por	prep	by; for (indicates something given in an exchange); through, out, via (indicating movement)
13	qué	det	what; which; what a; such
14	me	pron	accusative of yo: me; dative of yo: to me, for me; reflexive of yo: myself
15	una	noun	feminine of uno
16	los	article	masculine plural of el (“the”)
17	se	noun	abbreviation of sudeste; southeast
18	te	noun	The name of the Latin script letter T/t.
19	con	prep	with; Dependent preposition following certain verbs.
20	para	prep	for, to (expressing a recipient); to, in order to, so, for (expressing the intended purpose of an action); by, due, due on, due by (expressing a deadline)
21	está	verb	inflection of estar:; third-person singular present indicative
22	mi	det	apocopic form of mío, my
23	pero	conj	but; well well; so; well (used for emphasis); expresses surprise
24	sí	particle	yes, yeah, (used to respond affirmatively to a question, used both informally and formally); Used to give positive emphasis to a verb, which is often replaced. Functions similarly to English do.
25	si	name	abbreviation of Sinaloa: a state of Mexico
26	bien	adv	well (adverbial form of bueno); well; fine; okay (state of being satisfied with the status quo); properly
27	eso	pron	neuter singular of ése; that
28	su	det	apocopic form of suyo his, her, its, one's, their, your (formal); used to express an approximate number: about, approximately
29	las	article	feminine plural definite article; the
30	yo	pron	first-person singular pronoun in the nominative case; I
31	del	contraction	of the, from the (+ a masculine noun in singular).
32	como	name	Como (a city and comune, the capital of the province of Como, Lombardy); Como (a province of Lombardy, Italy); a number of places in the United States:
33	aquí	adv	here (in the speaker's location)
34	tu	det	apocopic form of tuyo, your
35	al	name	initialism of América Latina
36	más	adv	more; -er (used to make comparisons); most; -est (used to make superlatives); furthermore
37	le	pron	to him, for him; dative of él; to her, for her; dative of ella; to it, for it; dative of ello
38	esto	pron	neuter singular of este (“this”); substitutes a noun one can't remember or can't remember the name of
39	todo	det	all; every; each; every
40	ya	adv	now (often as opposed to before), anymore, no longer; indicates the completion of an action; yet (in questions)
41	estoy	verb	first-person singular present indicative of estar; am
42	ahora	adv	now (at the present time); just now, just a moment ago (in the past); very soon, in a moment (in the future)
43	muy	adv	apocopic form of mucho; very
44	ha	verb	third-person singular present indicative of haber
45	esta	det	feminine singular of este
46	así	adv	like this; like that; as such; thus; so; thereby; this way, that way; used to express wishes of misfortune against someone, or to cast a spell
47	vamos	intj	let's go!; come on! (expression of encouragement)
48	algo	pron	something, anything
49	hay	verb	third-person singular present indicative of haber
50	bueno	adj	good; tasty, yummy, good (of food); hot, sexy
51	tengo	verb	first-person singular present indicative of tener
52	cuando	adv	when
53	él	pron	he, him, masculine personal third person subject and disjunctive pronoun (used as a subject and after prepositions); it, masculine non-personal third-person subject and disjunctive pronoun (usually used after prepositions to refer to masculine nouns)
54	estás	verb	inflection of estar:; second-person singular present indicative
55	sé	verb	first-person singular present indicative of saber; inflection of ser; inflection of ser:
56	tú	pron	second person pronoun in singular tense; you
57	nos	pron	dative of nosotros: to us, for us; accusative of nosotros: us; reflexive of nosotros: ourselves; each other
58	nada	pron	nothing, zero, zilch, not...anything
59	cómo	adv	how?
60	este	det	this
61	o	character	The sixteenth letter of the Spanish alphabet, called o and written in the Latin script.
62	he	adv	here is; behold (+ aquí)
63	ser	verb	to be (essentially or identified as); to be (in the passive voice sense); to exist; to occur
64	tiene	verb	third-person singular present indicative of tener
65	puedo	verb	first-person singular present indicative of poder
66	ella	pron	she, her (used subjectively and after prepositions); it (used subjectively and after prepositions to refer to feminine nouns)
67	quiero	verb	first-person singular present indicative of querer
68	hacer	verb	to do; to make (something); to make (e.g. someone do something or feel a certain way.)
69	fue	verb	third-person singular preterite indicative of ir; third-person singular preterite indicative of ser
70	gracias	intj	thank you, thanks
71	vez	noun	time, instance; place (in a queue); turn (a chance to use (something) shared in sequence with others)
72	era	verb	first/third-person singular imperfect indicative of ser
73	soy	verb	first-person singular present indicative of ser
74	sólo	adv	superseded spelling of solo
75	todos	det	masculine plural of todo
76	porque	conj	because
77	son	noun	tone (pleasant sound); son (Afro-Cuban musical form); musical composition in this form
78	tienes	verb	second-person singular present indicative of tener
79	creo	verb	first-person singular present indicative of crear
80	voy	verb	first-person singular present indicative of ir
81	sabes	intj	you know? (rhetorical question)
82	estaba	verb	first/third-person singular imperfect indicative of estar
83	puede	intj	it's possible; could be
84	eres	verb	second-person singular present indicative of ser; you are
85	ese	noun	The name of the Latin script letter S/s.
86	usted	pron	second person formal; you (singular); second person informal; you (singular); you
87	entonces	adv	then, next, thereupon, at that time, at that point; then, therefore, so, thus; in that case
88	hola	intj	hello, hi, hey
89	solo	adj	sole; one; only; single (unique); lonely, lonesome; alone, by oneself
90	verdad	noun	truth; fact
91	casa	noun	house
92	tan	adv	so, as; very
93	quién	pron	who?, whom?; (with “de”) whose?; if only; I wish
94	sus	det	plural of su; one's, his, her, its, their (with plural possessee); your (with plural possessee)
95	tiempo	noun	time; a while, period of time, long time, length of time, indeterminate amount of time; tense
96	dos	num	two
97	esa	det	feminine singular of ese
98	nunca	adv	never; ever
99	dónde	adv	where?; in what place?; from where? whence?
100	va	verb	third-person singular present indicative of ir
101	oh	intj	oh (expression of awe, surprise, pain or realization)
102	favor	noun	favor/favour
103	mucho	det	much, a lot of; many, a lot of
104	quieres	verb	second-person singular present indicative of querer
105	mí	pron	me; (declined form of yo used as the object of a preposition)
106	siento	verb	first-person singular present indicative of sentar
107	señor	noun	mister, sir, lord (title conferred on a married or older male); gentleman; master
108	mejor	adj	better; better off; improved
109	hace	verb	third-person singular present indicative of hacer
110	has	verb	inflection of haber:; second-person singular present indicative
111	decir	verb	to say, to tell; to pronounce, sound out; to say, opine
112	también	adv	also, too, as well; so
113	sobre	prep	over, above, on, upon, atop; about
114	dios	noun	god
115	sin	prep	without
116	tenemos	verb	first-person plural present indicative of tener
117	están	verb	third-person plural present indicative of estar
118	ti	pron	prepositional of tú
119	puedes	verb	second-person singular present indicative of poder
120	ver	verb	to see, to spot; to see, to look at, to view (perceive); to see, to tell, to observe
121	hombre	noun	man, (adult male human); man, (all humans collectively); mankind, humankind; man, (individual of the species Homo sapiens, the genus Homo, or the subtribe Hominina)
122	vida	noun	life; lifestyle; livelihood; living
123	alguien	pron	someone, somebody; anyone, anybody
124	cosas	noun	plural of cosa
125	siempre	adv	always; in spite of it, still...at least; all the same, ultimately, in the end
126	hasta	adv	even
127	ahí	adv	there (away from the speaker); that (in certain phrases)
128	ir	verb	to go (away from speaker and listener); to be suitable or apt for its purpose, to match or suit well (of clothing); to head towards or lead to a place away from the speaker
129	años	noun	plural of año
130	antes	adv	earlier; before; sooner; previously; formerly; beforehand (at an earlier time); soon (in certain phrases); ahead (temporally), ahead of (when followed by de)
131	estar	verb	to be (have a temporary or permanent location in space); to be present; to be (denotes a copula, in a transient fashion)
132	ni	conj	Used when negating two or more elements, and not, not A or B, not A nor B, neither A nor B
133	poco	det	little, not much; few, not many; un-, not
134	día	noun	day (any period of 24 hours); day (a period from midnight to the following midnight); day (rotational period of a planet)
135	uno	num	one
136	noche	noun	night (the period between sunset and sunrise); evening (after sunset)
137	hecho	adj	done, completed; made
138	mis	det	plural of mi
139	estamos	verb	first-person plural present indicative of estar
140	otra	det	feminine singular of otro
141	acuerdo	noun	agreement; compromise
142	trabajo	noun	work, job; work; school assignment, often a presentation
143	nosotros	pron	we (masculine plural); ourselves
144	parece	verb	inflection of parecer:; third-person singular present indicative
145	gente	noun	people; guys, lads (used to address a group of people)
146	sea	verb	inflection of ser:; first/third-person singular present subjunctive
147	padre	noun	father
148	mira	noun	target; purpose, object; sight (of a weapon)
149	mismo	adj	same; identical; one and the same; indicates that the two compared noun clauses both represent the one thing; similar; alike; practically identical; indicates that the two compared noun clauses have one or more matching qualities; self; emphasizes the identity or singularity of the modified noun phrase
150	dijo	verb	third-person singular preterite indicative of decir
151	nadie	pron	no one; nobody (anyone or anybody)
152	quiere	verb	inflection of querer:; third-person singular present indicative
153	podría	verb	first/third-person singular conditional of poder
154	vas	verb	inflection of ir:; second-person singular present indicative
155	hablar	verb	to talk; to speak; to communicate using words; to speak (a language); to talk or chat regularly with someone, especially on social media
156	ellos	pron	plural of él (“they, them”)
157	sr.	noun	abbreviation of Señor (“Mister”); Mr.
158	tal	adj	such
159	pasa	noun	raisin
160	fuera	adv	outside
161	después	adv	later, afterwards, afterward, post; next; after
162	han	verb	third-person plural present indicative of haber
163	desde	prep	since (from a specified time in the past); from (a location); starting at (a quantity, such as a price)
164	dinero	noun	money; wealth
165	mundo	noun	world, earth (human collective existence); world, globe (the Earth); world (planet, especially one which is inhabitable)
166	claro	adj	clear (easily understood); light, pale (not dark in hue); bright (emitting much light)
167	momento	noun	moment, instant; timing; momentum
168	les	pron	dative of ellos and ellas; to them, for them; dative of ustedes; to you all, for you all (formal); accusative of ustedes; you all (formal)
169	tener	verb	to have; to possess; to have; to possess; to be (a condition or quality); to hold; to grasp
170	estado	noun	country, land (any broad area or territory); alternative letter-case form of Estado (“state, a territory with a formally recognized sovereign government; administration, its government”); state (a province, particularly a fairly autonomous one within a federation)
171	otro	det	other, another
172	había	verb	first/third-person singular imperfect indicative of haber; makes pluperfect to verbs as part of the auxiliary verb haber.
173	mañana	adv	tomorrow; soon, shortly
174	tenía	verb	first/third-person singular imperfect indicative of tener
175	madre	noun	mother; mother (source or origin); mother (nun)
176	vale	noun	a voucher; an IOU
177	lugar	noun	place
178	donde	adv	where, in what place; whence
179	haciendo	verb	gerund of hacer
180	seguro	adj	secure; safe (free from danger); certain; sure; positive; definite (of being correct); secure; firm; stable; reliable; surefire; foolproof (not likely to fall)
181	sabe	verb	inflection of saber:; third-person singular present indicative
182	podemos	verb	inflection of podar:; first-person plural present subjunctive
183	tus	det	plural of tu
184	espera	noun	wait
185	nuevo	adj	new; brand new, all-new; fresh
186	sido	verb	past participle of ser
187	cosa	noun	thing (object, concept); thing (living being)
188	hijo	noun	son; child (of unknown gender)
189	allí	adv	there (away from the speaker and the listener)
190	menos	adv	less; least
191	tipo	noun	kind, type, sort, manner; rate, interest rate; composure, cool
192	amigo	noun	friend; penis
193	gran	adj	apocopic form of grande; great, grand
194	nuestro	pron	ours
195	mujer	noun	woman; wife
196	mamá	noun	mum, mom; a term of affection for a woman
197	luego	adv	then (afterward); later, later on (at some point in the future); soon (within a short time)
198	papá	noun	dad; parents
199	días	noun	plural of día
200	dice	verb	third-person singular present indicative of decir
201	hoy	adv	today
202	tres	num	three
203	buena	noun	inheritance
204	necesito	verb	first-person singular present indicative of necesitar
205	dije	noun	adorns, locket; amulet, charm
206	oye	intj	hey! listen! (call to attract attention of a single person)
207	gusta	verb	inflection of gustar:; third-person singular present indicative
208	quería	verb	first/third-person singular imperfect indicative of querer
209	será	verb	third-person singular future indicative of ser
210	haber	verb	have; forms the perfect aspect; to hold, to possess; to exist; there be; “there is”, “there are” (hay); “there was”, “there were” (había)
211	parte	noun	part; section; portion; share; piece; bit; cut; proportion; place; somewhere; side
212	todas	det	feminine plural of todo
213	crees	verb	second-person singular present subjunctive of crear; second-person singular present indicative of creer
214	buen	adj	apocopic form of bueno (“good, fine”)
215	conmigo	adv	with me; with myself
216	nombre	noun	name; noun
217	mierda	noun	shit (solid excretory product evacuated from the bowels; feces.); shit (in expressions); piece of shit; a bad thing; an object of poor quality.
218	nuestra	det	feminine singular of nuestro
219	mal	adv	badly, poorly, ill; awry, amiss, wrong, wrongly; hard (functions as an adverb in Spanish but translates as an adjective in English)
220	debe	verb	inflection of deber:; third-person singular present indicative
221	realmente	adv	really, actually, genuinely
222	estas	det	feminine plural of este
223	aún	adv	still, yet; even (implying an extreme example in the case mentioned)
224	mío	pron	mine; of mine
225	toda	det	feminine singular of todo
226	hacerlo	verb	infinitive of hacer combined with lo
227	cada	det	each; every
228	visto	adj	seen; obvious, clear; exposed, bare
229	importa	verb	inflection of importar:; third-person singular present indicative
230	contigo	adv	with you (singular); with yourself
231	tienen	verb	third-person plural present indicative of tener
232	hemos	noun	plural of hemo
233	razón	noun	reason; reasoning; correctness, rectitude, a point
234	alguna	det	feminine singular of alguno
235	tanto	det	so much; as much; that much; so many, as many, that many
236	saber	verb	to know, to understand (a fact); to know how to do something; to find out, to learn
237	hizo	verb	third-person singular preterite indicative of hacer
238	veces	prep	by, times (multiplication)
239	serio	adj	serious, earnest, sober, solemn (without humor); serious, grave, deep (important, weighty); serious (really intending what was said)
240	ven	verb	second-person singular imperative of venir
241	idea	noun	idea
242	eh	intj	hey! (used to call, draw attention, warn or reprehend); uh, um (space filler in a conversation, expression of hesitation or pause in speech); huh?
243	tarde	adj	late
244	problema	noun	problem, issue, challenge (a difficulty or obstacle that has to be dealt with); trouble (in the singular or in the plural); question, dilemma, conundrum
245	hora	noun	"hour (a time period of sixty minutes); time (the moment, as indicated by a clock or similar device); high time (usually with ""ya"")"
246	cierto	adj	true
247	dicho	adj	mentioned, said, aforementioned
248	quien	pron	who; whom; whoever; whomever; anyone who
249	demasiado	adj	too much, too many, excessive
250	amor	name	a surname
251	ve	noun	The name of the Latin script letter V/v.
252	entre	prep	between; among, amongst, from; divided by
253	pasado	adj	past; former; last
254	familia	noun	family (group of people related to each other); family (grouping of things possessing common characteristics); relative, relation (member of one's family)
255	estos	det	masculine plural of este
256	policía	noun	Civility, polity, public order, police, fineness, neatness, urbanity; police, police department, police force, police service
257	debería	verb	first/third-person singular conditional of deber
258	ustedes	pron	you (plural), you guys, y'all, yous, yinz, ye
259	chica	noun	female equivalent of chico: girl; gal, chick; A spice made from the Sobralia orchid.
260	esos	det	plural of ese; those
261	chicos	adj	masculine plural of chico
262	cuenta	noun	count, tally; operation; bill
263	haces	noun	plural of haz
264	todavía	adv	still, yet; even, still
265	salir	verb	to go out, to leave, to depart, to head out; to go out, to come out (to leave one's abode to go to public places); to come out (e.g. from hiding), to come off (e.g. off the bench in a sport; off of a high place like a roof or ladder)
266	algún	det	apocopic form of alguno; some, any
267	vaya	intj	expresses surprise: wow!, why, oh!, whoa!, well!, man!, boy!; expresses dismay, worry, indignation or frustration: gee!, jeez!, gosh!, why, man!, oh dear!; what a ...
268	unos	article	masculine plural of un
269	veo	verb	first-person singular present indicative of ver
270	amigos	noun	plural of amigo
271	hermano	noun	brother; sibling; bro, dude (friendly term of address for a male of similar age.)
272	pensé	verb	first-person singular preterite indicative of pensar
273	sabía	verb	first/third-person singular imperfect indicative of saber
274	cabeza	noun	head; mind (in certain phrases)
275	ah	intj	ah (expression of relief, realization, awe); ah (expression of woe, grief)
276	cariño	noun	affection, fondness; caress; dear, darling, honey, love
277	digo	intj	I mean; used to explain or correct a previous utterance
278	van	noun	van (vehicle)
279	hombres	noun	plural of hombre
280	buenas	intj	hello, good morning, good afternoon, good evening (greeting used irrespective of the time)
281	somos	verb	first-person plural present indicative of ser
282	cualquier	det	apocopic form of cualquiera; any; whatever; whichever
283	forma	noun	shape; form; figure; way; manner; basis; method
284	mientras	adv	meanwhile
285	lado	noun	side; face
286	debo	verb	first-person singular present indicative of deber
287	sería	verb	first/third-person singular conditional of ser
288	caso	noun	case (situation or fact); case (instance of a medical condition); case
289	pueden	verb	third-person plural present indicative of poder
290	pasó	verb	third-person singular preterite indicative of pasar
291	primera	noun	first gear (lowest gear in a motor vehicle); first class
292	genial	adj	ingenious, genius; great, very good; genial, pleasant
293	chico	adj	small
294	supuesto	adj	supposed, self-styled, alleged
295	pues	conj	so, then; in that case; because, since
296	hice	verb	first-person singular preterite indicative of hacer
297	adiós	intj	goodbye, farewell
298	muchas	det	feminine plural of mucho
299	personas	noun	plural of persona
300	señora	noun	Ms; a title or form of address for a woman; formerly for a married, divorced, or widowed woman and now commonly for any adult woman regardless of marital status, depending on the region; lady; wife
301	volver	verb	to return, to revert, to get back; to come back, go back; to do again
302	esas	det	feminine plural of ese; those
303	quizá	adv	perhaps, maybe
304	contra	prep	against, versus
305	camino	noun	way, route; road; path
306	durante	prep	during, in, over; for (as a duration)
307	hablando	verb	gerund of hablar
308	manera	noun	way; manner; method; style
309	muerto	adj	dead; exhausted; dead tired; unupdated, inactive, outdated
310	persona	noun	person (an individual; usually a human being); a socially distinguished person, a personality; a wise or otherwise excellent person
311	rápido	adj	rapid, quick, fast
312	cuál	det	what; which
313	ayuda	noun	help, aid; assistance; guidance
314	historia	noun	history (the aggregate of past events); history (the branch of knowledge that studies the past); history (a set of events involving an entity)
315	iba	verb	first/third-person singular imperfect indicative of ir
316	supongo	verb	first-person singular present indicative of suponer
317	nueva	noun	news, novelty
318	entiendo	verb	first-person singular present indicative of entender
319	dentro	adv	inside (for space); indoors; within, in (for time)
320	casi	adv	almost
321	puerta	noun	door (portal of entry into a building); gate (doorlike structure outside a house); gate (passageway in an airport)
322	ves	verb	inflection of ver:; second-person singular present indicative
323	pasar	verb	to pass, to hand, to slip; to happen; to pass, to get past, to go past, to go by, to go over, to get through
324	primero	noun	former (in contrast to the latter), first, first one; one of the five bids in the card game of Primero, consisting of a combination of four cards in the hand
325	significa	verb	inflection of significar:; third-person singular present indicative
326	semana	noun	week (7 days)
327	hacia	prep	toward, towards; around, about (indicating time)
328	quizás	adv	maybe, perhaps
329	espero	verb	first-person singular present indicative of esperar
330	juntos	adj	masculine plural of junto
331	año	noun	year; age
332	niños	noun	plural of niño
333	pronto	adj	prompt, on time; ready
334	tío	noun	uncle (the brother, brother-in-law, or male cousin or cousin-in-law of either parent); unknown or any male person, dude, guy; friend, mate, pal, man, bro
335	suerte	noun	luck, fortune; lot, fate; sort, kind, type
336	ciudad	noun	city
337	feliz	adj	happy, merry (trait); pleased, glad; joyous, merry, happy
338	vi	verb	first-person singular preterite indicative of ver
339	siquiera	adv	at least, at the least; even
340	venir	verb	Senses relating to literal movement.; to come (move closer to some location (most often closer to the speaker), by default the speaker's location)
341	hija	noun	daughter; female equivalent of hijo
342	gustaría	verb	first/third-person singular conditional of gustar
343	minutos	noun	plural of minuto
344	cuánto	adv	how much; how many
345	os	pron	you, to you, for you; dative and accusative of vosotros
346	hey	intj	hey!
347	muerte	noun	death (the cessation of life); death (the personification of death as a hooded figure); death, demise (the collapse or end of something)
348	dejar	verb	to leave (to place); to leave, to keep (to allow to continue); to leave (to cause, result in)
349	realidad	noun	reality; commodity
350	deja	noun	rest (that remaining after cutting textiles)
351	da	verb	inflection of dar:; third-person singular present indicative
352	problemas	noun	plural of problema
353	importante	adj	important, that cares, that matters.
354	dijiste	verb	second-person singular preterite indicative of decir
355	corazón	noun	heart (organ of the body); heart, emotions, kindness, spirit; the center of an object
356	miedo	noun	fear
357	jefe	noun	chief; president; head; leader of a business, political party, or other organization; boss; supervisor; manager; colonel; major; rank between captain and general
358	agua	noun	water; body of water; rain (condensed water falling from a cloud)
359	haré	verb	first-person singular future indicative of hacer
360	justo	adv	right, just; exactly; tightly
361	horas	noun	plural of hora
362	poder	verb	to be able to, can; to be familiar with something, or with someone's personality
363	buenos	adj	masculine plural of bueno
364	esposa	noun	wife
365	manos	noun	plural of mano
366	debes	verb	second-person singular present indicative of deber
367	viene	verb	third-person singular present indicative of venir
368	venga	intj	A cheer or expression of support, encouragement, etc.; come on, attaboy; An expression of amazement or surprise; wow, whoa
369	nuestros	det	masculine plural of nuestro
370	ojos	noun	plural of ojo
371	adelante	adv	forward (toward the front); forward (into the future)
