word	sentence	translation	difficulty_rank
लय	बस उस कोने के आगे ही एक मदिरालय है।	There's a pub just around the corner.	7010
खत	मैं टीवी देखता हूँ।	I watch television.	7646
लगभग	मैं लगभग हर रोज़ खत लिखता हूं।	I write letters almost every day.	7646
खत	मैं लगभग हर रोज़ खत लिखता हूं।	I write letters almost every day.	7646
लगभग	मैं लगभग हर रोज़ खत लिखती हूं।	I write letters almost every day.	7646
खत	मैं लगभग हर रोज़ खत लिखती हूं।	I write letters almost every day.	7646
थ	कल मेरा जन्मदिन था।	Yesterday was my birthday.	7800
थ	बॉब यहाँ आया था ना?	Bob came here, didn't he?	7800
थ	तुमने उसे कब देखा था?	When did you see her?	7800
शहर	शहर के ऊपर काले बादल छा रहे थे।	Dark clouds were brooding over the city.	7800
ऊपर	शहर के ऊपर काले बादल छा रहे थे।	Dark clouds were brooding over the city.	7800
ओर	वह समुंदर की ओर चल रहा था।	He was walking toward the sea.	7800
सम	वह समुंदर की ओर चल रहा था।	He was walking toward the sea.	7800
बरस	कल रात बरसात हो रही थी।	It was raining last night.	7800
ठहर	जिम मेरे घर में ठहरा था।	Jim had stayed at my house.	7800
तक	हैदराबाद पर १९४८ तक निज़ाम का राज था।	Hyderabad was ruled by a nizam until 1948.	7800
ऊपर	हाथ ऊपर करो!	Hands up!	7800
आस	आसान था।	It was easy.	7800
जब	मैं जब उठा तो मैं दुखी था।	When I woke up, I was sad.	7800
शक	शक कौन थे?	Who were the Scythians?	7800
तर	तुम ख़तरे में थे।	You were in danger.	7800
तर	आप ख़तरे में थे।	You were in danger.	7800
दब	शादी में जल्दबाजी न करें।	Don't rush into marriage.	7842
आलस	मैं आलसी हूँ।	I'm lazy.	7878
आलस	कितने आलसी हो तुम।	You're so lazy.	7878
आलस	तुम कितनी आलसी हो।	You're so lazy.	7878
तम	कमरे में तम्बाकू की महक थी।	The room smelled of tobacco.	7894
महक	कमरे में तम्बाकू की महक थी।	The room smelled of tobacco.	7894
शमन	तुम्हारा दुशमन कौन है?	Who is your enemy?	7935
शमन	टॉम दुशमन है।	Tom is the enemy.	7935
शमन	वह हमारा दुशमन है।	He's our enemy.	7935
थन	मैं एंथनी।	I am Anthony.	8136
थन	एंथनी मैं हूँ।	I am Anthony.	8136
पहर	इस दोपहर को मिलते हैं।	Let's meet this afternoon.	8204
पहर	आज दोपहर बारिश होने वाली है।	It is going to rain this afternoon.	8204
पहर	वह कल दोपहर को मर गई।	She died yesterday afternoon.	8204
शत	टॉम शत्रु है।	Tom is the enemy.	8227
शत	वह हमारा शत्रु है।	He's our enemy.	8227
शत	वे हमारे शत्रु हैं।	He's our enemy.	8227
स	इस नोट को सिक्कों में बदल दीजिए।	Please change this bill into coins.	8657
बदल	इस नोट को सिक्कों में बदल दीजिए।	Please change this bill into coins.	8657
स	मैं टैक्सी का इंतेज़ार कर रहा था।	I was waiting for a taxi.	8657
इ	मैं टैक्सी का इंतेज़ार कर रहा था।	I was waiting for a taxi.	8657
स	शेर मास खाते हैं।	Lions feed on flesh.	8657
हल	ट्रेन हल्के से आकर रुकी।	The train came to a smooth stop.	8657
आकर	ट्रेन हल्के से आकर रुकी।	The train came to a smooth stop.	8657
आदत	बुरी आदतें कितनी आसानी से लग जातीं हैं!	How easily one acquires bad habits!	8657
उठकर	वह खाना खाने के बाद मेज़ से उठकर चली गई।	She left the table after dinner.	8657
हद	मैं तुम्हारे साथ एक हद तक सहमत हूँ।	I agree with you to a degree.	8657
तक	मैं तुम्हारे साथ एक हद तक सहमत हूँ।	I agree with you to a degree.	8657
सहमत	मैं तुम्हारे साथ एक हद तक सहमत हूँ।	I agree with you to a degree.	8657
खट	यह सेव खट्टा है ना?	This apple tastes sour, doesn't it?	8657
तक	मैंने खेल को शुरू से अंत तक देखा।	I watched the game from beginning to end.	8657
समय	तुम किस समय घर जाती हो?	What time do you go home?	8657
यम	हॅमिल्टन के दोस्तों में से एक ने नियम समझाएं।	One of Hamilton's friends explained the rules.	8657
टन	हॅमिल्टन के दोस्तों में से एक ने नियम समझाएं।	One of Hamilton's friends explained the rules.	8657
बचपन	खेल ही वास्तव में बचपन का काम है।	Play is really the work of childhood.	8657
तव	खेल ही वास्तव में बचपन का काम है।	Play is really the work of childhood.	8657
गण	वे गणित के क्लास में है।	They're in math class.	8657
तरह	वह किसी राजा की तरह जीता है।	He lives like a king.	8657
अमर	लूसी अमरीकी है।	Lucy is an American.	8657
बक	बक्से में कितने सेब थे?	How many apples were in the box?	8657
सबक	मैं तुम्हें सबक सिखाने वाला हूँ।	I'm going to teach you a lesson.	8657
सबक	मैं तुम्हें सबक सिखाने वाली हूँ।	I'm going to teach you a lesson.	8657
तब	तब तुम्हें कैसा लगा?	How did you feel then?	8657
डच	डच दूतावास कहाँ है?	Where is the Dutch embassy?	8657
कट	हमारा देश संकट में है।	Our country is in a crisis.	8657
बन	हम सब सैनिक बने।	We all became soldiers.	8657
परम	यहां एक हरा मैदान था; अब एक सुपरमार्केट है।	Here stood a green field; now it is a supermarket.	8657
वजह	किस वजह से?	What for?	8657
ओर	सामी ने बाहर की ओर देखा।	Sami looked outside.	8657
खट	सामी की शादी खट्टी हो गई।	Sami's marriage turned sour.	8657
आपस	आपसे सिगरेट की बू आ रही है।	You stink of cigarettes.	8657
आठ	वह आठ साल की है।	She is eight.	8657
नरक	सामी नरक में था।	Sami was in hell.	8657
बक	वे बक्से खाली हैं।	Those boxes are empty.	8657
हठ	टॉम हठी था।	Tom was obstinate.	8678
